05/22/25 17:33:49 EDT -0400 | ########## START ##########
05/22/25 17:33:49 EDT -0400 | Battery power mode
05/22/25 17:33:49 EDT -0400 | Shutdown scheduled for Thu 2025-05-22 18:03:49 EDT, use 'shutdown -c' to cancel.
05/22/25 17:33:49 EDT -0400 | ##########  END  ##########
05/22/25 21:33:49 EDT -0400 | ########## START ##########
05/22/25 21:33:49 EDT -0400 | Battery power mode
05/22/25 21:33:49 EDT -0400 | Shutdown scheduled for Thu 2025-05-22 22:03:49 EDT, use 'shutdown -c' to cancel.
05/22/25 21:33:49 EDT -0400 | ##########  END  ##########
05/23/25 01:33:49 EDT -0400 | ########## START ##########
05/23/25 01:33:49 EDT -0400 | Battery power mode
05/23/25 01:33:49 EDT -0400 | Shutdown scheduled for Fri 2025-05-23 02:03:49 EDT, use 'shutdown -c' to cancel.
05/23/25 01:33:49 EDT -0400 | ##########  END  ##########
05/23/25 05:33:49 EDT -0400 | ########## START ##########
05/23/25 05:33:49 EDT -0400 | Battery power mode
05/23/25 05:33:49 EDT -0400 | Shutdown scheduled for Fri 2025-05-23 06:03:49 EDT, use 'shutdown -c' to cancel.
05/23/25 05:33:49 EDT -0400 | ##########  END  ##########
05/23/25 09:33:49 EDT -0400 | ########## START ##########
05/23/25 09:33:49 EDT -0400 | Battery power mode
05/23/25 09:33:49 EDT -0400 | Shutdown scheduled for Fri 2025-05-23 10:03:49 EDT, use 'shutdown -c' to cancel.
05/23/25 09:33:49 EDT -0400 | ##########  END  ##########
05/23/25 13:33:49 EDT -0400 | ########## START ##########
05/23/25 13:33:49 EDT -0400 | Battery power mode
05/23/25 13:33:49 EDT -0400 | Shutdown scheduled for Fri 2025-05-23 14:03:49 EDT, use 'shutdown -c' to cancel.
05/23/25 13:33:49 EDT -0400 | ##########  END  ##########
05/23/25 17:33:50 EDT -0400 | ########## START ##########
05/23/25 17:33:50 EDT -0400 | Battery power mode
05/23/25 17:33:50 EDT -0400 | Shutdown scheduled for Fri 2025-05-23 18:03:50 EDT, use 'shutdown -c' to cancel.
05/23/25 17:33:50 EDT -0400 | ##########  END  ##########
05/23/25 21:33:50 EDT -0400 | ########## START ##########
05/23/25 21:33:50 EDT -0400 | Battery power mode
05/23/25 21:33:50 EDT -0400 | Shutdown scheduled for Fri 2025-05-23 22:03:50 EDT, use 'shutdown -c' to cancel.
05/23/25 21:33:50 EDT -0400 | ##########  END  ##########
05/24/25 01:33:49 EDT -0400 | ########## START ##########
05/24/25 01:33:49 EDT -0400 | Battery power mode
05/24/25 01:33:50 EDT -0400 | Shutdown scheduled for Sat 2025-05-24 02:03:50 EDT, use 'shutdown -c' to cancel.
05/24/25 01:33:50 EDT -0400 | ##########  END  ##########
05/24/25 05:33:49 EDT -0400 | ########## START ##########
05/24/25 05:33:49 EDT -0400 | Battery power mode
05/24/25 05:33:49 EDT -0400 | Shutdown scheduled for Sat 2025-05-24 06:03:49 EDT, use 'shutdown -c' to cancel.
05/24/25 05:33:49 EDT -0400 | ##########  END  ##########
05/24/25 09:33:50 EDT -0400 | ########## START ##########
05/24/25 09:33:50 EDT -0400 | Battery power mode
05/24/25 09:33:50 EDT -0400 | Shutdown scheduled for Sat 2025-05-24 10:03:50 EDT, use 'shutdown -c' to cancel.
05/24/25 09:33:50 EDT -0400 | ##########  END  ##########
05/24/25 13:33:50 EDT -0400 | ########## START ##########
05/24/25 13:33:50 EDT -0400 | Battery power mode
05/24/25 13:33:50 EDT -0400 | Shutdown scheduled for Sat 2025-05-24 14:03:50 EDT, use 'shutdown -c' to cancel.
05/24/25 13:33:50 EDT -0400 | ##########  END  ##########
05/24/25 17:33:50 EDT -0400 | ########## START ##########
05/24/25 17:33:50 EDT -0400 | Battery power mode
05/24/25 17:33:50 EDT -0400 | Shutdown scheduled for Sat 2025-05-24 18:03:50 EDT, use 'shutdown -c' to cancel.
05/24/25 17:33:50 EDT -0400 | ##########  END  ##########
05/24/25 21:33:50 EDT -0400 | ########## START ##########
05/24/25 21:33:50 EDT -0400 | Battery power mode
05/24/25 21:33:50 EDT -0400 | Shutdown scheduled for Sat 2025-05-24 22:03:50 EDT, use 'shutdown -c' to cancel.
05/24/25 21:33:50 EDT -0400 | ##########  END  ##########
05/25/25 01:33:50 EDT -0400 | ########## START ##########
05/25/25 01:33:50 EDT -0400 | Battery power mode
05/25/25 01:33:50 EDT -0400 | Shutdown scheduled for Sun 2025-05-25 02:03:50 EDT, use 'shutdown -c' to cancel.
05/25/25 01:33:50 EDT -0400 | ##########  END  ##########
05/25/25 05:33:51 EDT -0400 | ########## START ##########
05/25/25 05:33:51 EDT -0400 | Battery power mode
05/25/25 05:33:51 EDT -0400 | Shutdown scheduled for Sun 2025-05-25 06:03:51 EDT, use 'shutdown -c' to cancel.
05/25/25 05:33:51 EDT -0400 | ##########  END  ##########
05/25/25 09:33:50 EDT -0400 | ########## START ##########
05/25/25 09:33:50 EDT -0400 | Battery power mode
05/25/25 09:33:51 EDT -0400 | Shutdown scheduled for Sun 2025-05-25 10:03:50 EDT, use 'shutdown -c' to cancel.
05/25/25 09:33:51 EDT -0400 | ##########  END  ##########
05/25/25 13:33:51 EDT -0400 | ########## START ##########
05/25/25 13:33:51 EDT -0400 | Battery power mode
05/25/25 13:33:51 EDT -0400 | Shutdown scheduled for Sun 2025-05-25 14:03:51 EDT, use 'shutdown -c' to cancel.
05/25/25 13:33:51 EDT -0400 | ##########  END  ##########
05/25/25 17:33:50 EDT -0400 | ########## START ##########
05/25/25 17:33:50 EDT -0400 | Battery power mode
05/25/25 17:33:50 EDT -0400 | Shutdown scheduled for Sun 2025-05-25 18:03:50 EDT, use 'shutdown -c' to cancel.
05/25/25 17:33:50 EDT -0400 | ##########  END  ##########
05/25/25 21:33:50 EDT -0400 | ########## START ##########
05/25/25 21:33:50 EDT -0400 | Battery power mode
05/25/25 21:33:50 EDT -0400 | Shutdown scheduled for Sun 2025-05-25 22:03:50 EDT, use 'shutdown -c' to cancel.
05/25/25 21:33:50 EDT -0400 | ##########  END  ##########
05/26/25 01:33:50 EDT -0400 | ########## START ##########
05/26/25 01:33:50 EDT -0400 | Battery power mode
05/26/25 01:33:50 EDT -0400 | Shutdown scheduled for Mon 2025-05-26 02:03:50 EDT, use 'shutdown -c' to cancel.
05/26/25 01:33:50 EDT -0400 | ##########  END  ##########
05/26/25 05:33:51 EDT -0400 | ########## START ##########
05/26/25 05:33:51 EDT -0400 | Battery power mode
05/26/25 05:33:51 EDT -0400 | Shutdown scheduled for Mon 2025-05-26 06:03:51 EDT, use 'shutdown -c' to cancel.
05/26/25 05:33:51 EDT -0400 | ##########  END  ##########
05/26/25 09:33:51 EDT -0400 | ########## START ##########
05/26/25 09:33:51 EDT -0400 | Battery power mode
05/26/25 09:33:51 EDT -0400 | Shutdown scheduled for Mon 2025-05-26 10:03:51 EDT, use 'shutdown -c' to cancel.
05/26/25 09:33:51 EDT -0400 | ##########  END  ##########
05/26/25 13:33:50 EDT -0400 | ########## START ##########
05/26/25 13:33:50 EDT -0400 | Battery power mode
05/26/25 13:33:51 EDT -0400 | Shutdown scheduled for Mon 2025-05-26 14:03:50 EDT, use 'shutdown -c' to cancel.
05/26/25 13:33:51 EDT -0400 | ##########  END  ##########
05/26/25 17:33:51 EDT -0400 | ########## START ##########
05/26/25 17:33:51 EDT -0400 | Battery power mode
05/26/25 17:33:51 EDT -0400 | Shutdown scheduled for Mon 2025-05-26 18:03:51 EDT, use 'shutdown -c' to cancel.
05/26/25 17:33:51 EDT -0400 | ##########  END  ##########
05/26/25 21:33:51 EDT -0400 | ########## START ##########
05/26/25 21:33:51 EDT -0400 | Battery power mode
05/26/25 21:33:51 EDT -0400 | Shutdown scheduled for Mon 2025-05-26 22:03:51 EDT, use 'shutdown -c' to cancel.
05/26/25 21:33:51 EDT -0400 | ##########  END  ##########
05/27/25 01:33:51 EDT -0400 | ########## START ##########
05/27/25 01:33:51 EDT -0400 | Battery power mode
05/27/25 01:33:51 EDT -0400 | Shutdown scheduled for Tue 2025-05-27 02:03:51 EDT, use 'shutdown -c' to cancel.
05/27/25 01:33:51 EDT -0400 | ##########  END  ##########
05/27/25 05:33:51 EDT -0400 | ########## START ##########
05/27/25 05:33:51 EDT -0400 | Battery power mode
05/27/25 05:33:51 EDT -0400 | Shutdown scheduled for Tue 2025-05-27 06:03:51 EDT, use 'shutdown -c' to cancel.
05/27/25 05:33:51 EDT -0400 | ##########  END  ##########
05/27/25 09:33:51 EDT -0400 | ########## START ##########
05/27/25 09:33:51 EDT -0400 | Battery power mode
05/27/25 09:33:51 EDT -0400 | Shutdown scheduled for Tue 2025-05-27 10:03:51 EDT, use 'shutdown -c' to cancel.
05/27/25 09:33:51 EDT -0400 | ##########  END  ##########
05/27/25 13:33:52 EDT -0400 | ########## START ##########
05/27/25 13:33:52 EDT -0400 | Battery power mode
05/27/25 13:33:52 EDT -0400 | Shutdown scheduled for Tue 2025-05-27 14:03:52 EDT, use 'shutdown -c' to cancel.
05/27/25 13:33:52 EDT -0400 | ##########  END  ##########
05/27/25 17:33:52 EDT -0400 | ########## START ##########
05/27/25 17:33:52 EDT -0400 | Battery power mode
05/27/25 17:33:52 EDT -0400 | Shutdown scheduled for Tue 2025-05-27 18:03:52 EDT, use 'shutdown -c' to cancel.
05/27/25 17:33:52 EDT -0400 | ##########  END  ##########
05/27/25 21:33:52 EDT -0400 | ########## START ##########
05/27/25 21:33:52 EDT -0400 | Battery power mode
05/27/25 21:33:52 EDT -0400 | Shutdown scheduled for Tue 2025-05-27 22:03:52 EDT, use 'shutdown -c' to cancel.
05/27/25 21:33:52 EDT -0400 | ##########  END  ##########
05/28/25 01:33:52 EDT -0400 | ########## START ##########
05/28/25 01:33:52 EDT -0400 | Battery power mode
05/28/25 01:33:52 EDT -0400 | Shutdown scheduled for Wed 2025-05-28 02:03:52 EDT, use 'shutdown -c' to cancel.
05/28/25 01:33:52 EDT -0400 | ##########  END  ##########
05/28/25 05:33:52 EDT -0400 | ########## START ##########
05/28/25 05:33:52 EDT -0400 | Battery power mode
05/28/25 05:33:52 EDT -0400 | Shutdown scheduled for Wed 2025-05-28 06:03:52 EDT, use 'shutdown -c' to cancel.
05/28/25 05:33:52 EDT -0400 | ##########  END  ##########
05/28/25 09:33:52 EDT -0400 | ########## START ##########
05/28/25 09:33:52 EDT -0400 | Battery power mode
05/28/25 09:33:52 EDT -0400 | Shutdown scheduled for Wed 2025-05-28 10:03:52 EDT, use 'shutdown -c' to cancel.
05/28/25 09:33:52 EDT -0400 | ##########  END  ##########
05/28/25 13:33:52 EDT -0400 | ########## START ##########
05/28/25 13:33:52 EDT -0400 | Battery power mode
05/28/25 13:33:52 EDT -0400 | Shutdown scheduled for Wed 2025-05-28 14:03:52 EDT, use 'shutdown -c' to cancel.
05/28/25 13:33:52 EDT -0400 | ##########  END  ##########
05/28/25 17:33:53 EDT -0400 | ########## START ##########
05/28/25 17:33:53 EDT -0400 | Battery power mode
05/28/25 17:33:53 EDT -0400 | Shutdown scheduled for Wed 2025-05-28 18:03:53 EDT, use 'shutdown -c' to cancel.
05/28/25 17:33:53 EDT -0400 | ##########  END  ##########
05/28/25 21:33:52 EDT -0400 | ########## START ##########
05/28/25 21:33:52 EDT -0400 | Battery power mode
05/28/25 21:33:52 EDT -0400 | Shutdown scheduled for Wed 2025-05-28 22:03:52 EDT, use 'shutdown -c' to cancel.
05/28/25 21:33:52 EDT -0400 | ##########  END  ##########
05/29/25 01:33:52 EDT -0400 | ########## START ##########
05/29/25 01:33:52 EDT -0400 | Battery power mode
05/29/25 01:33:52 EDT -0400 | Shutdown scheduled for Thu 2025-05-29 02:03:52 EDT, use 'shutdown -c' to cancel.
05/29/25 01:33:53 EDT -0400 | ##########  END  ##########
05/29/25 02:06:08 EDT -0400 | ########## START ##########
05/29/25 02:06:08 EDT -0400 | Battery power mode
05/29/25 02:06:08 EDT -0400 | Shutdown scheduled for Thu 2025-05-29 02:36:08 EDT, use 'shutdown -c' to cancel.
05/29/25 02:06:08 EDT -0400 | ##########  END  ##########
05/29/25 09:33:53 EDT -0400 | ########## START ##########
05/29/25 09:33:53 EDT -0400 | Battery power mode
05/29/25 09:33:53 EDT -0400 | Shutdown scheduled for Thu 2025-05-29 10:03:53 EDT, use 'shutdown -c' to cancel.
05/29/25 09:33:53 EDT -0400 | ##########  END  ##########
05/29/25 13:33:52 EDT -0400 | ########## START ##########
05/29/25 13:33:52 EDT -0400 | Battery power mode
05/29/25 13:33:53 EDT -0400 | Shutdown scheduled for Thu 2025-05-29 14:03:53 EDT, use 'shutdown -c' to cancel.
05/29/25 13:33:53 EDT -0400 | ##########  END  ##########
05/29/25 17:33:52 EDT -0400 | ########## START ##########
05/29/25 17:33:52 EDT -0400 | Battery power mode
05/29/25 17:33:52 EDT -0400 | Shutdown scheduled for Thu 2025-05-29 18:03:52 EDT, use 'shutdown -c' to cancel.
05/29/25 17:33:52 EDT -0400 | ##########  END  ##########
05/29/25 21:33:53 EDT -0400 | ########## START ##########
05/29/25 21:33:53 EDT -0400 | Battery power mode
05/29/25 21:33:53 EDT -0400 | Shutdown scheduled for Thu 2025-05-29 22:03:53 EDT, use 'shutdown -c' to cancel.
05/29/25 21:33:53 EDT -0400 | ##########  END  ##########
05/30/25 01:33:54 EDT -0400 | ########## START ##########
05/30/25 01:33:54 EDT -0400 | Battery power mode
05/30/25 01:33:54 EDT -0400 | Shutdown scheduled for Fri 2025-05-30 02:03:54 EDT, use 'shutdown -c' to cancel.
05/30/25 01:33:54 EDT -0400 | ##########  END  ##########
05/30/25 05:33:53 EDT -0400 | ########## START ##########
05/30/25 05:33:53 EDT -0400 | Battery power mode
05/30/25 05:33:53 EDT -0400 | Shutdown scheduled for Fri 2025-05-30 06:03:53 EDT, use 'shutdown -c' to cancel.
05/30/25 05:33:53 EDT -0400 | ##########  END  ##########
05/30/25 09:33:52 EDT -0400 | ########## START ##########
05/30/25 09:33:52 EDT -0400 | Battery power mode
05/30/25 09:33:53 EDT -0400 | Shutdown scheduled for Fri 2025-05-30 10:03:53 EDT, use 'shutdown -c' to cancel.
05/30/25 09:33:53 EDT -0400 | ##########  END  ##########
05/30/25 13:33:53 EDT -0400 | ########## START ##########
05/30/25 13:33:53 EDT -0400 | Battery power mode
05/30/25 13:33:53 EDT -0400 | Shutdown scheduled for Fri 2025-05-30 14:03:53 EDT, use 'shutdown -c' to cancel.
05/30/25 13:33:53 EDT -0400 | ##########  END  ##########
05/30/25 17:33:53 EDT -0400 | ########## START ##########
05/30/25 17:33:53 EDT -0400 | Battery power mode
05/30/25 17:33:53 EDT -0400 | Shutdown scheduled for Fri 2025-05-30 18:03:53 EDT, use 'shutdown -c' to cancel.
05/30/25 17:33:53 EDT -0400 | ##########  END  ##########
05/30/25 21:33:54 EDT -0400 | ########## START ##########
05/30/25 21:33:54 EDT -0400 | Battery power mode
05/30/25 21:33:54 EDT -0400 | Shutdown scheduled for Fri 2025-05-30 22:03:54 EDT, use 'shutdown -c' to cancel.
05/30/25 21:33:54 EDT -0400 | ##########  END  ##########
05/31/25 01:33:53 EDT -0400 | ########## START ##########
05/31/25 01:33:53 EDT -0400 | Battery power mode
05/31/25 01:33:53 EDT -0400 | Shutdown scheduled for Sat 2025-05-31 02:03:53 EDT, use 'shutdown -c' to cancel.
05/31/25 01:33:53 EDT -0400 | ##########  END  ##########
05/31/25 05:33:53 EDT -0400 | ########## START ##########
05/31/25 05:33:53 EDT -0400 | Battery power mode
05/31/25 05:33:53 EDT -0400 | Shutdown scheduled for Sat 2025-05-31 06:03:53 EDT, use 'shutdown -c' to cancel.
05/31/25 05:33:53 EDT -0400 | ##########  END  ##########
05/31/25 09:33:53 EDT -0400 | ########## START ##########
05/31/25 09:33:53 EDT -0400 | Battery power mode
05/31/25 09:33:53 EDT -0400 | Shutdown scheduled for Sat 2025-05-31 10:03:53 EDT, use 'shutdown -c' to cancel.
05/31/25 09:33:53 EDT -0400 | ##########  END  ##########
05/31/25 13:33:53 EDT -0400 | ########## START ##########
05/31/25 13:33:53 EDT -0400 | Battery power mode
05/31/25 13:33:53 EDT -0400 | Shutdown scheduled for Sat 2025-05-31 14:03:53 EDT, use 'shutdown -c' to cancel.
05/31/25 13:33:53 EDT -0400 | ##########  END  ##########
05/31/25 17:33:54 EDT -0400 | ########## START ##########
05/31/25 17:33:54 EDT -0400 | Battery power mode
05/31/25 17:33:54 EDT -0400 | Shutdown scheduled for Sat 2025-05-31 18:03:54 EDT, use 'shutdown -c' to cancel.
05/31/25 17:33:54 EDT -0400 | ##########  END  ##########
05/31/25 21:33:53 EDT -0400 | ########## START ##########
05/31/25 21:33:53 EDT -0400 | Battery power mode
05/31/25 21:33:53 EDT -0400 | Shutdown scheduled for Sat 2025-05-31 22:03:53 EDT, use 'shutdown -c' to cancel.
05/31/25 21:33:53 EDT -0400 | ##########  END  ##########
06/01/25 01:33:53 EDT -0400 | ########## START ##########
06/01/25 01:33:53 EDT -0400 | Battery power mode
06/01/25 01:33:54 EDT -0400 | Shutdown scheduled for Sun 2025-06-01 02:03:54 EDT, use 'shutdown -c' to cancel.
06/01/25 01:33:54 EDT -0400 | ##########  END  ##########
06/01/25 05:33:54 EDT -0400 | ########## START ##########
06/01/25 05:33:54 EDT -0400 | Battery power mode
06/01/25 05:33:54 EDT -0400 | Shutdown scheduled for Sun 2025-06-01 06:03:54 EDT, use 'shutdown -c' to cancel.
06/01/25 05:33:54 EDT -0400 | ##########  END  ##########
06/01/25 09:33:54 EDT -0400 | ########## START ##########
06/01/25 09:33:54 EDT -0400 | Battery power mode
06/01/25 09:33:54 EDT -0400 | Shutdown scheduled for Sun 2025-06-01 10:03:54 EDT, use 'shutdown -c' to cancel.
06/01/25 09:33:54 EDT -0400 | ##########  END  ##########
06/01/25 13:33:54 EDT -0400 | ########## START ##########
06/01/25 13:33:54 EDT -0400 | Battery power mode
06/01/25 13:33:54 EDT -0400 | Shutdown scheduled for Sun 2025-06-01 14:03:54 EDT, use 'shutdown -c' to cancel.
06/01/25 13:33:54 EDT -0400 | ##########  END  ##########
06/01/25 17:33:54 EDT -0400 | ########## START ##########
06/01/25 17:33:54 EDT -0400 | Battery power mode
06/01/25 17:33:54 EDT -0400 | Shutdown scheduled for Sun 2025-06-01 18:03:54 EDT, use 'shutdown -c' to cancel.
06/01/25 17:33:54 EDT -0400 | ##########  END  ##########
06/01/25 21:33:54 EDT -0400 | ########## START ##########
06/01/25 21:33:54 EDT -0400 | Battery power mode
06/01/25 21:33:54 EDT -0400 | Shutdown scheduled for Sun 2025-06-01 22:03:54 EDT, use 'shutdown -c' to cancel.
06/01/25 21:33:54 EDT -0400 | ##########  END  ##########
06/02/25 01:33:54 EDT -0400 | ########## START ##########
06/02/25 01:33:54 EDT -0400 | Battery power mode
06/02/25 01:33:54 EDT -0400 | Shutdown scheduled for Mon 2025-06-02 02:03:54 EDT, use 'shutdown -c' to cancel.
06/02/25 01:33:54 EDT -0400 | ##########  END  ##########
06/02/25 05:33:53 EDT -0400 | ########## START ##########
06/02/25 05:33:53 EDT -0400 | Battery power mode
06/02/25 05:33:53 EDT -0400 | Shutdown scheduled for Mon 2025-06-02 06:03:53 EDT, use 'shutdown -c' to cancel.
06/02/25 05:33:53 EDT -0400 | ##########  END  ##########
06/02/25 09:33:54 EDT -0400 | ########## START ##########
06/02/25 09:33:54 EDT -0400 | Battery power mode
06/02/25 09:33:54 EDT -0400 | Shutdown scheduled for Mon 2025-06-02 10:03:54 EDT, use 'shutdown -c' to cancel.
06/02/25 09:33:54 EDT -0400 | ##########  END  ##########
06/02/25 13:33:54 EDT -0400 | ########## START ##########
06/02/25 13:33:54 EDT -0400 | Battery power mode
06/02/25 13:33:54 EDT -0400 | Shutdown scheduled for Mon 2025-06-02 14:03:54 EDT, use 'shutdown -c' to cancel.
06/02/25 13:33:55 EDT -0400 | ##########  END  ##########
06/02/25 17:33:55 EDT -0400 | ########## START ##########
06/02/25 17:33:55 EDT -0400 | Battery power mode
06/02/25 17:33:55 EDT -0400 | Shutdown scheduled for Mon 2025-06-02 18:03:55 EDT, use 'shutdown -c' to cancel.
06/02/25 17:33:55 EDT -0400 | ##########  END  ##########
06/02/25 21:33:54 EDT -0400 | ########## START ##########
06/02/25 21:33:54 EDT -0400 | Battery power mode
06/02/25 21:33:54 EDT -0400 | Shutdown scheduled for Mon 2025-06-02 22:03:54 EDT, use 'shutdown -c' to cancel.
06/02/25 21:33:54 EDT -0400 | ##########  END  ##########
06/03/25 01:33:54 EDT -0400 | ########## START ##########
06/03/25 01:33:54 EDT -0400 | Battery power mode
06/03/25 01:33:54 EDT -0400 | Shutdown scheduled for Tue 2025-06-03 02:03:54 EDT, use 'shutdown -c' to cancel.
06/03/25 01:33:54 EDT -0400 | ##########  END  ##########
06/03/25 05:33:55 EDT -0400 | ########## START ##########
06/03/25 05:33:55 EDT -0400 | Battery power mode
06/03/25 05:33:55 EDT -0400 | Shutdown scheduled for Tue 2025-06-03 06:03:55 EDT, use 'shutdown -c' to cancel.
06/03/25 05:33:55 EDT -0400 | ##########  END  ##########
06/03/25 09:33:55 EDT -0400 | ########## START ##########
06/03/25 09:33:55 EDT -0400 | Battery power mode
06/03/25 09:33:55 EDT -0400 | Shutdown scheduled for Tue 2025-06-03 10:03:55 EDT, use 'shutdown -c' to cancel.
06/03/25 09:33:55 EDT -0400 | ##########  END  ##########
06/03/25 13:33:55 EDT -0400 | ########## START ##########
06/03/25 13:33:55 EDT -0400 | Battery power mode
06/03/25 13:33:55 EDT -0400 | Shutdown scheduled for Tue 2025-06-03 14:03:55 EDT, use 'shutdown -c' to cancel.
06/03/25 13:33:55 EDT -0400 | ##########  END  ##########
06/03/25 17:33:54 EDT -0400 | ########## START ##########
06/03/25 17:33:54 EDT -0400 | Battery power mode
06/03/25 17:33:55 EDT -0400 | Shutdown scheduled for Tue 2025-06-03 18:03:55 EDT, use 'shutdown -c' to cancel.
06/03/25 17:33:55 EDT -0400 | ##########  END  ##########
06/03/25 21:33:55 EDT -0400 | ########## START ##########
06/03/25 21:33:55 EDT -0400 | Battery power mode
06/03/25 21:33:55 EDT -0400 | Shutdown scheduled for Tue 2025-06-03 22:03:55 EDT, use 'shutdown -c' to cancel.
06/03/25 21:33:55 EDT -0400 | ##########  END  ##########
06/04/25 01:33:55 EDT -0400 | ########## START ##########
06/04/25 01:33:55 EDT -0400 | Battery power mode
06/04/25 01:33:55 EDT -0400 | Shutdown scheduled for Wed 2025-06-04 02:03:55 EDT, use 'shutdown -c' to cancel.
06/04/25 01:33:55 EDT -0400 | ##########  END  ##########
06/04/25 05:33:55 EDT -0400 | ########## START ##########
06/04/25 05:33:55 EDT -0400 | Battery power mode
06/04/25 05:33:55 EDT -0400 | Shutdown scheduled for Wed 2025-06-04 06:03:55 EDT, use 'shutdown -c' to cancel.
06/04/25 05:33:55 EDT -0400 | ##########  END  ##########
06/04/25 09:33:55 EDT -0400 | ########## START ##########
06/04/25 09:33:55 EDT -0400 | Battery power mode
06/04/25 09:33:55 EDT -0400 | Shutdown scheduled for Wed 2025-06-04 10:03:55 EDT, use 'shutdown -c' to cancel.
06/04/25 09:33:55 EDT -0400 | ##########  END  ##########
06/04/25 13:33:47 EDT -0400 | ########## START ##########
06/04/25 13:33:47 EDT -0400 | Battery power mode
06/04/25 13:33:47 EDT -0400 | Shutdown scheduled for Wed 2025-06-04 14:03:47 EDT, use 'shutdown -c' to cancel.
06/04/25 13:33:47 EDT -0400 | ##########  END  ##########
06/04/25 17:33:46 EDT -0400 | ########## START ##########
06/04/25 17:33:46 EDT -0400 | Battery power mode
06/04/25 17:33:47 EDT -0400 | Shutdown scheduled for Wed 2025-06-04 18:03:47 EDT, use 'shutdown -c' to cancel.
06/04/25 17:33:47 EDT -0400 | ##########  END  ##########
06/04/25 21:33:47 EDT -0400 | ########## START ##########
06/04/25 21:33:47 EDT -0400 | Battery power mode
06/04/25 21:33:47 EDT -0400 | Shutdown scheduled for Wed 2025-06-04 22:03:47 EDT, use 'shutdown -c' to cancel.
06/04/25 21:33:47 EDT -0400 | ##########  END  ##########
06/05/25 01:33:55 EDT -0400 | ########## START ##########
06/05/25 01:33:55 EDT -0400 | Battery power mode
06/05/25 01:33:55 EDT -0400 | Shutdown scheduled for Thu 2025-06-05 02:03:55 EDT, use 'shutdown -c' to cancel.
06/05/25 01:33:55 EDT -0400 | ##########  END  ##########
06/05/25 05:33:55 EDT -0400 | ########## START ##########
06/05/25 05:33:55 EDT -0400 | Battery power mode
06/05/25 05:33:55 EDT -0400 | Shutdown scheduled for Thu 2025-06-05 06:03:55 EDT, use 'shutdown -c' to cancel.
06/05/25 05:33:55 EDT -0400 | ##########  END  ##########
06/05/25 09:33:55 EDT -0400 | ########## START ##########
06/05/25 09:33:55 EDT -0400 | Battery power mode
06/05/25 09:33:55 EDT -0400 | Shutdown scheduled for Thu 2025-06-05 10:03:55 EDT, use 'shutdown -c' to cancel.
06/05/25 09:33:55 EDT -0400 | ##########  END  ##########
06/05/25 13:33:47 EDT -0400 | ########## START ##########
06/05/25 13:33:47 EDT -0400 | Battery power mode
06/05/25 13:33:47 EDT -0400 | Shutdown scheduled for Thu 2025-06-05 14:03:47 EDT, use 'shutdown -c' to cancel.
06/05/25 13:33:47 EDT -0400 | ##########  END  ##########
06/05/25 17:33:46 EDT -0400 | ########## START ##########
06/05/25 17:33:46 EDT -0400 | Battery power mode
06/05/25 17:33:47 EDT -0400 | Shutdown scheduled for Thu 2025-06-05 18:03:47 EDT, use 'shutdown -c' to cancel.
06/05/25 17:33:47 EDT -0400 | ##########  END  ##########
06/05/25 21:33:55 EDT -0400 | ########## START ##########
06/05/25 21:33:55 EDT -0400 | Battery power mode
06/05/25 21:33:56 EDT -0400 | Shutdown scheduled for Thu 2025-06-05 22:03:56 EDT, use 'shutdown -c' to cancel.
06/05/25 21:33:56 EDT -0400 | ##########  END  ##########
06/06/25 01:33:55 EDT -0400 | ########## START ##########
06/06/25 01:33:55 EDT -0400 | Battery power mode
06/06/25 01:33:55 EDT -0400 | Shutdown scheduled for Fri 2025-06-06 02:03:55 EDT, use 'shutdown -c' to cancel.
06/06/25 01:33:55 EDT -0400 | ##########  END  ##########
06/06/25 05:33:56 EDT -0400 | ########## START ##########
06/06/25 05:33:56 EDT -0400 | Battery power mode
06/06/25 05:33:56 EDT -0400 | Shutdown scheduled for Fri 2025-06-06 06:03:56 EDT, use 'shutdown -c' to cancel.
06/06/25 05:33:56 EDT -0400 | ##########  END  ##########
06/06/25 09:33:55 EDT -0400 | ########## START ##########
06/06/25 09:33:55 EDT -0400 | Battery power mode
06/06/25 09:33:55 EDT -0400 | Shutdown scheduled for Fri 2025-06-06 10:03:55 EDT, use 'shutdown -c' to cancel.
06/06/25 09:33:55 EDT -0400 | ##########  END  ##########
06/06/25 13:33:47 EDT -0400 | ########## START ##########
06/06/25 13:33:47 EDT -0400 | Battery power mode
06/06/25 13:33:47 EDT -0400 | Shutdown scheduled for Fri 2025-06-06 14:03:47 EDT, use 'shutdown -c' to cancel.
06/06/25 13:33:47 EDT -0400 | ##########  END  ##########
06/06/25 17:33:47 EDT -0400 | ########## START ##########
06/06/25 17:33:47 EDT -0400 | Battery power mode
06/06/25 17:33:47 EDT -0400 | Shutdown scheduled for Fri 2025-06-06 18:03:47 EDT, use 'shutdown -c' to cancel.
06/06/25 17:33:47 EDT -0400 | ##########  END  ##########
06/06/25 21:33:46 EDT -0400 | ########## START ##########
06/06/25 21:33:46 EDT -0400 | Battery power mode
06/06/25 21:33:47 EDT -0400 | Shutdown scheduled for Fri 2025-06-06 22:03:47 EDT, use 'shutdown -c' to cancel.
06/06/25 21:33:47 EDT -0400 | ##########  END  ##########
06/07/25 01:33:56 EDT -0400 | ########## START ##########
06/07/25 01:33:56 EDT -0400 | Battery power mode
06/07/25 01:33:56 EDT -0400 | Shutdown scheduled for Sat 2025-06-07 02:03:56 EDT, use 'shutdown -c' to cancel.
06/07/25 01:33:56 EDT -0400 | ##########  END  ##########
06/07/25 05:33:55 EDT -0400 | ########## START ##########
06/07/25 05:33:55 EDT -0400 | Battery power mode
06/07/25 05:33:56 EDT -0400 | Shutdown scheduled for Sat 2025-06-07 06:03:56 EDT, use 'shutdown -c' to cancel.
06/07/25 05:33:56 EDT -0400 | ##########  END  ##########
06/07/25 09:33:55 EDT -0400 | ########## START ##########
06/07/25 09:33:55 EDT -0400 | Battery power mode
06/07/25 09:33:56 EDT -0400 | Shutdown scheduled for Sat 2025-06-07 10:03:56 EDT, use 'shutdown -c' to cancel.
06/07/25 09:33:56 EDT -0400 | ##########  END  ##########
06/07/25 13:33:56 EDT -0400 | ########## START ##########
06/07/25 13:33:56 EDT -0400 | Battery power mode
06/07/25 13:33:56 EDT -0400 | Shutdown scheduled for Sat 2025-06-07 14:03:56 EDT, use 'shutdown -c' to cancel.
06/07/25 13:33:56 EDT -0400 | ##########  END  ##########
06/07/25 17:33:47 EDT -0400 | ########## START ##########
06/07/25 17:33:47 EDT -0400 | Battery power mode
06/07/25 17:33:47 EDT -0400 | Shutdown scheduled for Sat 2025-06-07 18:03:47 EDT, use 'shutdown -c' to cancel.
06/07/25 17:33:47 EDT -0400 | ##########  END  ##########
06/07/25 21:33:56 EDT -0400 | ########## START ##########
06/07/25 21:33:56 EDT -0400 | Battery power mode
06/07/25 21:33:56 EDT -0400 | Shutdown scheduled for Sat 2025-06-07 22:03:56 EDT, use 'shutdown -c' to cancel.
06/07/25 21:33:56 EDT -0400 | ##########  END  ##########
06/08/25 01:33:56 EDT -0400 | ########## START ##########
06/08/25 01:33:56 EDT -0400 | Battery power mode
06/08/25 01:33:56 EDT -0400 | Shutdown scheduled for Sun 2025-06-08 02:03:56 EDT, use 'shutdown -c' to cancel.
06/08/25 01:33:56 EDT -0400 | ##########  END  ##########
06/08/25 05:33:56 EDT -0400 | ########## START ##########
06/08/25 05:33:56 EDT -0400 | Battery power mode
06/08/25 05:33:56 EDT -0400 | Shutdown scheduled for Sun 2025-06-08 06:03:56 EDT, use 'shutdown -c' to cancel.
06/08/25 05:33:56 EDT -0400 | ##########  END  ##########
06/08/25 09:33:56 EDT -0400 | ########## START ##########
06/08/25 09:33:56 EDT -0400 | Battery power mode
06/08/25 09:33:56 EDT -0400 | Shutdown scheduled for Sun 2025-06-08 10:03:56 EDT, use 'shutdown -c' to cancel.
06/08/25 09:33:56 EDT -0400 | ##########  END  ##########
06/08/25 13:33:47 EDT -0400 | ########## START ##########
06/08/25 13:33:47 EDT -0400 | Battery power mode
06/08/25 13:33:47 EDT -0400 | Shutdown scheduled for Sun 2025-06-08 14:03:47 EDT, use 'shutdown -c' to cancel.
06/08/25 13:33:47 EDT -0400 | ##########  END  ##########
06/08/25 17:33:47 EDT -0400 | ########## START ##########
06/08/25 17:33:47 EDT -0400 | Battery power mode
06/08/25 17:33:47 EDT -0400 | Shutdown scheduled for Sun 2025-06-08 18:03:47 EDT, use 'shutdown -c' to cancel.
06/08/25 17:33:47 EDT -0400 | ##########  END  ##########
06/08/25 21:33:56 EDT -0400 | ########## START ##########
06/08/25 21:33:56 EDT -0400 | Battery power mode
06/08/25 21:33:56 EDT -0400 | Shutdown scheduled for Sun 2025-06-08 22:03:56 EDT, use 'shutdown -c' to cancel.
06/08/25 21:33:56 EDT -0400 | ##########  END  ##########
06/09/25 01:33:57 EDT -0400 | ########## START ##########
06/09/25 01:33:57 EDT -0400 | Battery power mode
06/09/25 01:33:57 EDT -0400 | Shutdown scheduled for Mon 2025-06-09 02:03:57 EDT, use 'shutdown -c' to cancel.
06/09/25 01:33:57 EDT -0400 | ##########  END  ##########
06/09/25 05:33:55 EDT -0400 | ########## START ##########
06/09/25 05:33:55 EDT -0400 | Battery power mode
06/09/25 05:33:56 EDT -0400 | Shutdown scheduled for Mon 2025-06-09 06:03:56 EDT, use 'shutdown -c' to cancel.
06/09/25 05:33:56 EDT -0400 | ##########  END  ##########
06/09/25 09:33:56 EDT -0400 | ########## START ##########
06/09/25 09:33:56 EDT -0400 | Battery power mode
06/09/25 09:33:56 EDT -0400 | Shutdown scheduled for Mon 2025-06-09 10:03:56 EDT, use 'shutdown -c' to cancel.
06/09/25 09:33:56 EDT -0400 | ##########  END  ##########
06/09/25 13:33:48 EDT -0400 | ########## START ##########
06/09/25 13:33:48 EDT -0400 | Battery power mode
06/09/25 13:33:48 EDT -0400 | Shutdown scheduled for Mon 2025-06-09 14:03:48 EDT, use 'shutdown -c' to cancel.
06/09/25 13:33:48 EDT -0400 | ##########  END  ##########
06/09/25 17:33:47 EDT -0400 | ########## START ##########
06/09/25 17:33:47 EDT -0400 | Battery power mode
06/09/25 17:33:47 EDT -0400 | Shutdown scheduled for Mon 2025-06-09 18:03:47 EDT, use 'shutdown -c' to cancel.
06/09/25 17:33:47 EDT -0400 | ##########  END  ##########
06/09/25 21:33:56 EDT -0400 | ########## START ##########
06/09/25 21:33:56 EDT -0400 | Battery power mode
06/09/25 21:33:56 EDT -0400 | Shutdown scheduled for Mon 2025-06-09 22:03:56 EDT, use 'shutdown -c' to cancel.
06/09/25 21:33:56 EDT -0400 | ##########  END  ##########
06/10/25 01:33:56 EDT -0400 | ########## START ##########
06/10/25 01:33:56 EDT -0400 | Battery power mode
06/10/25 01:33:56 EDT -0400 | Shutdown scheduled for Tue 2025-06-10 02:03:56 EDT, use 'shutdown -c' to cancel.
06/10/25 01:33:56 EDT -0400 | ##########  END  ##########
06/10/25 05:33:55 EDT -0400 | ########## START ##########
06/10/25 05:33:55 EDT -0400 | Battery power mode
06/10/25 05:33:56 EDT -0400 | Shutdown scheduled for Tue 2025-06-10 06:03:56 EDT, use 'shutdown -c' to cancel.
06/10/25 05:33:56 EDT -0400 | ##########  END  ##########
06/10/25 09:33:56 EDT -0400 | ########## START ##########
06/10/25 09:33:56 EDT -0400 | Battery power mode
06/10/25 09:33:56 EDT -0400 | Shutdown scheduled for Tue 2025-06-10 10:03:56 EDT, use 'shutdown -c' to cancel.
06/10/25 09:33:56 EDT -0400 | ##########  END  ##########
06/10/25 13:33:56 EDT -0400 | ########## START ##########
06/10/25 13:33:56 EDT -0400 | Battery power mode
06/10/25 13:33:56 EDT -0400 | Shutdown scheduled for Tue 2025-06-10 14:03:56 EDT, use 'shutdown -c' to cancel.
06/10/25 13:33:56 EDT -0400 | ##########  END  ##########
06/10/25 17:33:56 EDT -0400 | ########## START ##########
06/10/25 17:33:56 EDT -0400 | Battery power mode
06/10/25 17:33:56 EDT -0400 | Shutdown scheduled for Tue 2025-06-10 18:03:56 EDT, use 'shutdown -c' to cancel.
06/10/25 17:33:56 EDT -0400 | ##########  END  ##########
06/10/25 21:33:56 EDT -0400 | ########## START ##########
06/10/25 21:33:56 EDT -0400 | Battery power mode
06/10/25 21:33:57 EDT -0400 | Shutdown scheduled for Tue 2025-06-10 22:03:57 EDT, use 'shutdown -c' to cancel.
06/10/25 21:33:57 EDT -0400 | ##########  END  ##########
06/11/25 01:33:56 EDT -0400 | ########## START ##########
06/11/25 01:33:56 EDT -0400 | Battery power mode
06/11/25 01:33:56 EDT -0400 | Shutdown scheduled for Wed 2025-06-11 02:03:56 EDT, use 'shutdown -c' to cancel.
06/11/25 01:33:56 EDT -0400 | ##########  END  ##########
06/11/25 05:33:57 EDT -0400 | ########## START ##########
06/11/25 05:33:57 EDT -0400 | Battery power mode
06/11/25 05:33:57 EDT -0400 | Shutdown scheduled for Wed 2025-06-11 06:03:57 EDT, use 'shutdown -c' to cancel.
06/11/25 05:33:57 EDT -0400 | ##########  END  ##########
06/11/25 09:33:56 EDT -0400 | ########## START ##########
06/11/25 09:33:56 EDT -0400 | Battery power mode
06/11/25 09:33:56 EDT -0400 | Shutdown scheduled for Wed 2025-06-11 10:03:56 EDT, use 'shutdown -c' to cancel.
06/11/25 09:33:56 EDT -0400 | ##########  END  ##########
06/11/25 13:33:47 EDT -0400 | ########## START ##########
06/11/25 13:33:47 EDT -0400 | Battery power mode
06/11/25 13:33:47 EDT -0400 | Shutdown scheduled for Wed 2025-06-11 14:03:47 EDT, use 'shutdown -c' to cancel.
06/11/25 13:33:47 EDT -0400 | ##########  END  ##########
06/11/25 17:33:48 EDT -0400 | ########## START ##########
06/11/25 17:33:48 EDT -0400 | Battery power mode
06/11/25 17:33:48 EDT -0400 | Shutdown scheduled for Wed 2025-06-11 18:03:48 EDT, use 'shutdown -c' to cancel.
06/11/25 17:33:48 EDT -0400 | ##########  END  ##########
06/11/25 21:33:57 EDT -0400 | ########## START ##########
06/11/25 21:33:57 EDT -0400 | Battery power mode
06/11/25 21:33:57 EDT -0400 | Shutdown scheduled for Wed 2025-06-11 22:03:57 EDT, use 'shutdown -c' to cancel.
06/11/25 21:33:57 EDT -0400 | ##########  END  ##########
06/12/25 01:33:56 EDT -0400 | ########## START ##########
06/12/25 01:33:56 EDT -0400 | Battery power mode
06/12/25 01:33:57 EDT -0400 | Shutdown scheduled for Thu 2025-06-12 02:03:57 EDT, use 'shutdown -c' to cancel.
06/12/25 01:33:57 EDT -0400 | ##########  END  ##########
06/12/25 05:33:56 EDT -0400 | ########## START ##########
06/12/25 05:33:56 EDT -0400 | Battery power mode
06/12/25 05:33:56 EDT -0400 | Shutdown scheduled for Thu 2025-06-12 06:03:56 EDT, use 'shutdown -c' to cancel.
06/12/25 05:33:56 EDT -0400 | ##########  END  ##########
06/12/25 09:33:57 EDT -0400 | ########## START ##########
06/12/25 09:33:57 EDT -0400 | Battery power mode
06/12/25 09:33:58 EDT -0400 | Shutdown scheduled for Thu 2025-06-12 10:03:58 EDT, use 'shutdown -c' to cancel.
06/12/25 09:33:58 EDT -0400 | ##########  END  ##########
06/12/25 13:33:48 EDT -0400 | ########## START ##########
06/12/25 13:33:48 EDT -0400 | Battery power mode
06/12/25 13:33:48 EDT -0400 | Shutdown scheduled for Thu 2025-06-12 14:03:48 EDT, use 'shutdown -c' to cancel.
06/12/25 13:33:48 EDT -0400 | ##########  END  ##########
06/12/25 17:33:48 EDT -0400 | ########## START ##########
06/12/25 17:33:48 EDT -0400 | Battery power mode
06/12/25 17:33:48 EDT -0400 | Shutdown scheduled for Thu 2025-06-12 18:03:48 EDT, use 'shutdown -c' to cancel.
06/12/25 17:33:48 EDT -0400 | ##########  END  ##########
06/12/25 21:33:58 EDT -0400 | ########## START ##########
06/12/25 21:33:58 EDT -0400 | Battery power mode
06/12/25 21:33:58 EDT -0400 | Shutdown scheduled for Thu 2025-06-12 22:03:58 EDT, use 'shutdown -c' to cancel.
06/12/25 21:33:58 EDT -0400 | ##########  END  ##########
06/13/25 01:33:56 EDT -0400 | ########## START ##########
06/13/25 01:33:56 EDT -0400 | Battery power mode
06/13/25 01:33:56 EDT -0400 | Shutdown scheduled for Fri 2025-06-13 02:03:56 EDT, use 'shutdown -c' to cancel.
06/13/25 01:33:56 EDT -0400 | ##########  END  ##########
06/13/25 05:33:56 EDT -0400 | ########## START ##########
06/13/25 05:33:56 EDT -0400 | Battery power mode
06/13/25 05:33:56 EDT -0400 | Shutdown scheduled for Fri 2025-06-13 06:03:56 EDT, use 'shutdown -c' to cancel.
06/13/25 05:33:56 EDT -0400 | ##########  END  ##########
06/13/25 09:33:56 EDT -0400 | ########## START ##########
06/13/25 09:33:56 EDT -0400 | Battery power mode
06/13/25 09:33:56 EDT -0400 | Shutdown scheduled for Fri 2025-06-13 10:03:56 EDT, use 'shutdown -c' to cancel.
06/13/25 09:33:56 EDT -0400 | ##########  END  ##########
06/13/25 13:33:56 EDT -0400 | ########## START ##########
06/13/25 13:33:56 EDT -0400 | Battery power mode
06/13/25 13:33:56 EDT -0400 | Shutdown scheduled for Fri 2025-06-13 14:03:56 EDT, use 'shutdown -c' to cancel.
06/13/25 13:33:56 EDT -0400 | ##########  END  ##########
06/13/25 17:33:56 EDT -0400 | ########## START ##########
06/13/25 17:33:56 EDT -0400 | Battery power mode
06/13/25 17:33:56 EDT -0400 | Shutdown scheduled for Fri 2025-06-13 18:03:56 EDT, use 'shutdown -c' to cancel.
06/13/25 17:33:56 EDT -0400 | ##########  END  ##########
06/13/25 21:33:56 EDT -0400 | ########## START ##########
06/13/25 21:33:56 EDT -0400 | Battery power mode
06/13/25 21:33:56 EDT -0400 | Shutdown scheduled for Fri 2025-06-13 22:03:56 EDT, use 'shutdown -c' to cancel.
06/13/25 21:33:56 EDT -0400 | ##########  END  ##########
06/14/25 01:33:56 EDT -0400 | ########## START ##########
06/14/25 01:33:56 EDT -0400 | Battery power mode
06/14/25 01:33:56 EDT -0400 | Shutdown scheduled for Sat 2025-06-14 02:03:56 EDT, use 'shutdown -c' to cancel.
06/14/25 01:33:56 EDT -0400 | ##########  END  ##########
06/14/25 05:33:56 EDT -0400 | ########## START ##########
06/14/25 05:33:56 EDT -0400 | Battery power mode
06/14/25 05:33:56 EDT -0400 | Shutdown scheduled for Sat 2025-06-14 06:03:56 EDT, use 'shutdown -c' to cancel.
06/14/25 05:33:56 EDT -0400 | ##########  END  ##########
06/14/25 09:33:57 EDT -0400 | ########## START ##########
06/14/25 09:33:57 EDT -0400 | Battery power mode
06/14/25 09:33:57 EDT -0400 | Shutdown scheduled for Sat 2025-06-14 10:03:57 EDT, use 'shutdown -c' to cancel.
06/14/25 09:33:57 EDT -0400 | ##########  END  ##########
06/14/25 13:33:56 EDT -0400 | ########## START ##########
06/14/25 13:33:56 EDT -0400 | Battery power mode
06/14/25 13:33:56 EDT -0400 | Shutdown scheduled for Sat 2025-06-14 14:03:56 EDT, use 'shutdown -c' to cancel.
06/14/25 13:33:56 EDT -0400 | ##########  END  ##########
06/14/25 17:33:56 EDT -0400 | ########## START ##########
06/14/25 17:33:56 EDT -0400 | Battery power mode
06/14/25 17:33:56 EDT -0400 | Shutdown scheduled for Sat 2025-06-14 18:03:56 EDT, use 'shutdown -c' to cancel.
06/14/25 17:33:56 EDT -0400 | ##########  END  ##########
06/14/25 21:33:57 EDT -0400 | ########## START ##########
06/14/25 21:33:57 EDT -0400 | Battery power mode
06/14/25 21:33:57 EDT -0400 | Shutdown scheduled for Sat 2025-06-14 22:03:57 EDT, use 'shutdown -c' to cancel.
06/14/25 21:33:57 EDT -0400 | ##########  END  ##########
06/15/25 01:33:58 EDT -0400 | ########## START ##########
06/15/25 01:33:58 EDT -0400 | Battery power mode
06/15/25 01:33:58 EDT -0400 | Shutdown scheduled for Sun 2025-06-15 02:03:58 EDT, use 'shutdown -c' to cancel.
06/15/25 01:33:58 EDT -0400 | ##########  END  ##########
06/15/25 05:33:56 EDT -0400 | ########## START ##########
06/15/25 05:33:56 EDT -0400 | Battery power mode
06/15/25 05:33:57 EDT -0400 | Shutdown scheduled for Sun 2025-06-15 06:03:57 EDT, use 'shutdown -c' to cancel.
06/15/25 05:33:57 EDT -0400 | ##########  END  ##########
06/15/25 09:33:57 EDT -0400 | ########## START ##########
06/15/25 09:33:57 EDT -0400 | Battery power mode
06/15/25 09:33:57 EDT -0400 | Shutdown scheduled for Sun 2025-06-15 10:03:57 EDT, use 'shutdown -c' to cancel.
06/15/25 09:33:57 EDT -0400 | ##########  END  ##########
06/15/25 13:33:56 EDT -0400 | ########## START ##########
06/15/25 13:33:56 EDT -0400 | Battery power mode
06/15/25 13:33:57 EDT -0400 | Shutdown scheduled for Sun 2025-06-15 14:03:57 EDT, use 'shutdown -c' to cancel.
06/15/25 13:33:57 EDT -0400 | ##########  END  ##########
06/15/25 17:33:57 EDT -0400 | ########## START ##########
06/15/25 17:33:57 EDT -0400 | Battery power mode
06/15/25 17:33:57 EDT -0400 | Shutdown scheduled for Sun 2025-06-15 18:03:57 EDT, use 'shutdown -c' to cancel.
06/15/25 17:33:57 EDT -0400 | ##########  END  ##########
06/15/25 21:33:56 EDT -0400 | ########## START ##########
06/15/25 21:33:56 EDT -0400 | Battery power mode
06/15/25 21:33:57 EDT -0400 | Shutdown scheduled for Sun 2025-06-15 22:03:57 EDT, use 'shutdown -c' to cancel.
06/15/25 21:33:57 EDT -0400 | ##########  END  ##########
06/16/25 01:33:56 EDT -0400 | ########## START ##########
06/16/25 01:33:56 EDT -0400 | Battery power mode
06/16/25 01:33:57 EDT -0400 | Shutdown scheduled for Mon 2025-06-16 02:03:57 EDT, use 'shutdown -c' to cancel.
06/16/25 01:33:57 EDT -0400 | ##########  END  ##########
06/16/25 05:33:56 EDT -0400 | ########## START ##########
06/16/25 05:33:56 EDT -0400 | Battery power mode
06/16/25 05:33:56 EDT -0400 | Shutdown scheduled for Mon 2025-06-16 06:03:56 EDT, use 'shutdown -c' to cancel.
06/16/25 05:33:56 EDT -0400 | ##########  END  ##########
06/16/25 09:33:57 EDT -0400 | ########## START ##########
06/16/25 09:33:57 EDT -0400 | Battery power mode
06/16/25 09:33:57 EDT -0400 | Shutdown scheduled for Mon 2025-06-16 10:03:57 EDT, use 'shutdown -c' to cancel.
06/16/25 09:33:57 EDT -0400 | ##########  END  ##########
06/16/25 13:33:57 EDT -0400 | ########## START ##########
06/16/25 13:33:57 EDT -0400 | Battery power mode
06/16/25 13:33:57 EDT -0400 | Shutdown scheduled for Mon 2025-06-16 14:03:57 EDT, use 'shutdown -c' to cancel.
06/16/25 13:33:57 EDT -0400 | ##########  END  ##########
06/16/25 17:33:57 EDT -0400 | ########## START ##########
06/16/25 17:33:57 EDT -0400 | Battery power mode
06/16/25 17:33:57 EDT -0400 | Shutdown scheduled for Mon 2025-06-16 18:03:57 EDT, use 'shutdown -c' to cancel.
06/16/25 17:33:57 EDT -0400 | ##########  END  ##########
06/16/25 21:33:57 EDT -0400 | ########## START ##########
06/16/25 21:33:57 EDT -0400 | Battery power mode
06/16/25 21:33:57 EDT -0400 | Shutdown scheduled for Mon 2025-06-16 22:03:57 EDT, use 'shutdown -c' to cancel.
06/16/25 21:33:57 EDT -0400 | ##########  END  ##########
06/17/25 01:33:57 EDT -0400 | ########## START ##########
06/17/25 01:33:57 EDT -0400 | Battery power mode
06/17/25 01:33:57 EDT -0400 | Shutdown scheduled for Tue 2025-06-17 02:03:57 EDT, use 'shutdown -c' to cancel.
06/17/25 01:33:57 EDT -0400 | ##########  END  ##########
06/17/25 05:33:57 EDT -0400 | ########## START ##########
06/17/25 05:33:57 EDT -0400 | Battery power mode
06/17/25 05:33:57 EDT -0400 | Shutdown scheduled for Tue 2025-06-17 06:03:57 EDT, use 'shutdown -c' to cancel.
06/17/25 05:33:57 EDT -0400 | ##########  END  ##########
06/17/25 09:33:57 EDT -0400 | ########## START ##########
06/17/25 09:33:57 EDT -0400 | Battery power mode
06/17/25 09:33:57 EDT -0400 | Shutdown scheduled for Tue 2025-06-17 10:03:57 EDT, use 'shutdown -c' to cancel.
06/17/25 09:33:57 EDT -0400 | ##########  END  ##########
06/17/25 13:33:57 EDT -0400 | ########## START ##########
06/17/25 13:33:57 EDT -0400 | Battery power mode
06/17/25 13:33:57 EDT -0400 | Shutdown scheduled for Tue 2025-06-17 14:03:57 EDT, use 'shutdown -c' to cancel.
06/17/25 13:33:57 EDT -0400 | ##########  END  ##########
06/17/25 17:33:57 EDT -0400 | ########## START ##########
06/17/25 17:33:57 EDT -0400 | Battery power mode
06/17/25 17:33:57 EDT -0400 | Shutdown scheduled for Tue 2025-06-17 18:03:57 EDT, use 'shutdown -c' to cancel.
06/17/25 17:33:57 EDT -0400 | ##########  END  ##########
06/17/25 21:33:57 EDT -0400 | ########## START ##########
06/17/25 21:33:57 EDT -0400 | Battery power mode
06/17/25 21:33:57 EDT -0400 | Shutdown scheduled for Tue 2025-06-17 22:03:57 EDT, use 'shutdown -c' to cancel.
06/17/25 21:33:57 EDT -0400 | ##########  END  ##########
06/18/25 01:33:58 EDT -0400 | ########## START ##########
06/18/25 01:33:58 EDT -0400 | Battery power mode
06/18/25 01:33:58 EDT -0400 | Shutdown scheduled for Wed 2025-06-18 02:03:58 EDT, use 'shutdown -c' to cancel.
06/18/25 01:33:58 EDT -0400 | ##########  END  ##########
06/18/25 05:33:57 EDT -0400 | ########## START ##########
06/18/25 05:33:57 EDT -0400 | Battery power mode
06/18/25 05:33:57 EDT -0400 | Shutdown scheduled for Wed 2025-06-18 06:03:57 EDT, use 'shutdown -c' to cancel.
06/18/25 05:33:57 EDT -0400 | ##########  END  ##########
06/18/25 09:33:57 EDT -0400 | ########## START ##########
06/18/25 09:33:57 EDT -0400 | Battery power mode
06/18/25 09:33:57 EDT -0400 | Shutdown scheduled for Wed 2025-06-18 10:03:57 EDT, use 'shutdown -c' to cancel.
06/18/25 09:33:57 EDT -0400 | ##########  END  ##########
06/18/25 13:33:57 EDT -0400 | ########## START ##########
06/18/25 13:33:57 EDT -0400 | Battery power mode
06/18/25 13:33:57 EDT -0400 | Shutdown scheduled for Wed 2025-06-18 14:03:57 EDT, use 'shutdown -c' to cancel.
06/18/25 13:33:57 EDT -0400 | ##########  END  ##########
06/18/25 17:33:57 EDT -0400 | ########## START ##########
06/18/25 17:33:57 EDT -0400 | Battery power mode
06/18/25 17:33:57 EDT -0400 | Shutdown scheduled for Wed 2025-06-18 18:03:57 EDT, use 'shutdown -c' to cancel.
06/18/25 17:33:58 EDT -0400 | ##########  END  ##########
06/18/25 21:33:57 EDT -0400 | ########## START ##########
06/18/25 21:33:57 EDT -0400 | Battery power mode
06/18/25 21:33:57 EDT -0400 | Shutdown scheduled for Wed 2025-06-18 22:03:57 EDT, use 'shutdown -c' to cancel.
06/18/25 21:33:57 EDT -0400 | ##########  END  ##########
06/19/25 01:33:57 EDT -0400 | ########## START ##########
06/19/25 01:33:57 EDT -0400 | Battery power mode
06/19/25 01:33:57 EDT -0400 | Shutdown scheduled for Thu 2025-06-19 02:03:57 EDT, use 'shutdown -c' to cancel.
06/19/25 01:33:57 EDT -0400 | ##########  END  ##########
06/19/25 05:33:58 EDT -0400 | ########## START ##########
06/19/25 05:33:58 EDT -0400 | Battery power mode
06/19/25 05:33:58 EDT -0400 | Shutdown scheduled for Thu 2025-06-19 06:03:58 EDT, use 'shutdown -c' to cancel.
06/19/25 05:33:58 EDT -0400 | ##########  END  ##########
06/19/25 09:33:58 EDT -0400 | ########## START ##########
06/19/25 09:33:58 EDT -0400 | Battery power mode
06/19/25 09:33:58 EDT -0400 | Shutdown scheduled for Thu 2025-06-19 10:03:58 EDT, use 'shutdown -c' to cancel.
06/19/25 09:33:58 EDT -0400 | ##########  END  ##########
06/19/25 13:33:57 EDT -0400 | ########## START ##########
06/19/25 13:33:57 EDT -0400 | Battery power mode
06/19/25 13:33:57 EDT -0400 | Shutdown scheduled for Thu 2025-06-19 14:03:57 EDT, use 'shutdown -c' to cancel.
06/19/25 13:33:57 EDT -0400 | ##########  END  ##########
06/19/25 17:33:57 EDT -0400 | ########## START ##########
06/19/25 17:33:57 EDT -0400 | Battery power mode
06/19/25 17:33:57 EDT -0400 | Shutdown scheduled for Thu 2025-06-19 18:03:57 EDT, use 'shutdown -c' to cancel.
06/19/25 17:33:57 EDT -0400 | ##########  END  ##########
06/19/25 21:33:57 EDT -0400 | ########## START ##########
06/19/25 21:33:57 EDT -0400 | Battery power mode
06/19/25 21:33:57 EDT -0400 | Shutdown scheduled for Thu 2025-06-19 22:03:57 EDT, use 'shutdown -c' to cancel.
06/19/25 21:33:57 EDT -0400 | ##########  END  ##########
06/20/25 01:33:58 EDT -0400 | ########## START ##########
06/20/25 01:33:58 EDT -0400 | Battery power mode
06/20/25 01:33:58 EDT -0400 | Shutdown scheduled for Fri 2025-06-20 02:03:58 EDT, use 'shutdown -c' to cancel.
06/20/25 01:33:58 EDT -0400 | ##########  END  ##########
06/20/25 05:33:58 EDT -0400 | ########## START ##########
06/20/25 05:33:58 EDT -0400 | Battery power mode
06/20/25 05:33:58 EDT -0400 | Shutdown scheduled for Fri 2025-06-20 06:03:58 EDT, use 'shutdown -c' to cancel.
06/20/25 05:33:58 EDT -0400 | ##########  END  ##########
06/20/25 09:33:58 EDT -0400 | ########## START ##########
06/20/25 09:33:58 EDT -0400 | Battery power mode
06/20/25 09:33:58 EDT -0400 | Shutdown scheduled for Fri 2025-06-20 10:03:58 EDT, use 'shutdown -c' to cancel.
06/20/25 09:33:58 EDT -0400 | ##########  END  ##########
06/20/25 13:33:57 EDT -0400 | ########## START ##########
06/20/25 13:33:57 EDT -0400 | Battery power mode
06/20/25 13:33:57 EDT -0400 | Shutdown scheduled for Fri 2025-06-20 14:03:57 EDT, use 'shutdown -c' to cancel.
06/20/25 13:33:57 EDT -0400 | ##########  END  ##########
06/20/25 17:33:57 EDT -0400 | ########## START ##########
06/20/25 17:33:57 EDT -0400 | Battery power mode
06/20/25 17:33:58 EDT -0400 | Shutdown scheduled for Fri 2025-06-20 18:03:58 EDT, use 'shutdown -c' to cancel.
06/20/25 17:33:58 EDT -0400 | ##########  END  ##########
06/20/25 21:33:58 EDT -0400 | ########## START ##########
06/20/25 21:33:58 EDT -0400 | Battery power mode
06/20/25 21:33:58 EDT -0400 | Shutdown scheduled for Fri 2025-06-20 22:03:58 EDT, use 'shutdown -c' to cancel.
06/20/25 21:33:58 EDT -0400 | ##########  END  ##########
06/21/25 01:33:58 EDT -0400 | ########## START ##########
06/21/25 01:33:58 EDT -0400 | Battery power mode
06/21/25 01:33:58 EDT -0400 | Shutdown scheduled for Sat 2025-06-21 02:03:58 EDT, use 'shutdown -c' to cancel.
06/21/25 01:33:58 EDT -0400 | ##########  END  ##########
06/21/25 05:33:57 EDT -0400 | ########## START ##########
06/21/25 05:33:57 EDT -0400 | Battery power mode
06/21/25 05:33:58 EDT -0400 | Shutdown scheduled for Sat 2025-06-21 06:03:58 EDT, use 'shutdown -c' to cancel.
06/21/25 05:33:58 EDT -0400 | ##########  END  ##########
06/21/25 09:34:00 EDT -0400 | ########## START ##########
06/21/25 09:34:00 EDT -0400 | Battery power mode
06/21/25 09:34:00 EDT -0400 | Shutdown scheduled for Sat 2025-06-21 10:04:00 EDT, use 'shutdown -c' to cancel.
06/21/25 09:34:00 EDT -0400 | ##########  END  ##########
06/21/25 13:33:49 EDT -0400 | ########## START ##########
06/21/25 13:33:49 EDT -0400 | Battery power mode
06/21/25 13:33:50 EDT -0400 | Shutdown scheduled for Sat 2025-06-21 14:03:50 EDT, use 'shutdown -c' to cancel.
06/21/25 13:33:50 EDT -0400 | ##########  END  ##########
06/21/25 17:33:50 EDT -0400 | ########## START ##########
06/21/25 17:33:50 EDT -0400 | Battery power mode
06/21/25 17:33:50 EDT -0400 | Shutdown scheduled for Sat 2025-06-21 18:03:50 EDT, use 'shutdown -c' to cancel.
06/21/25 17:33:50 EDT -0400 | ##########  END  ##########
06/21/25 21:33:58 EDT -0400 | ########## START ##########
06/21/25 21:33:58 EDT -0400 | Battery power mode
06/21/25 21:33:58 EDT -0400 | Shutdown scheduled for Sat 2025-06-21 22:03:58 EDT, use 'shutdown -c' to cancel.
06/21/25 21:33:58 EDT -0400 | ##########  END  ##########
06/22/25 01:33:58 EDT -0400 | ########## START ##########
06/22/25 01:33:58 EDT -0400 | Battery power mode
06/22/25 01:33:58 EDT -0400 | Shutdown scheduled for Sun 2025-06-22 02:03:58 EDT, use 'shutdown -c' to cancel.
06/22/25 01:33:58 EDT -0400 | ##########  END  ##########
06/22/25 05:33:58 EDT -0400 | ########## START ##########
06/22/25 05:33:58 EDT -0400 | Battery power mode
06/22/25 05:33:58 EDT -0400 | Shutdown scheduled for Sun 2025-06-22 06:03:58 EDT, use 'shutdown -c' to cancel.
06/22/25 05:33:58 EDT -0400 | ##########  END  ##########
06/22/25 09:33:58 EDT -0400 | ########## START ##########
06/22/25 09:33:58 EDT -0400 | Battery power mode
06/22/25 09:33:58 EDT -0400 | Shutdown scheduled for Sun 2025-06-22 10:03:58 EDT, use 'shutdown -c' to cancel.
06/22/25 09:33:58 EDT -0400 | ##########  END  ##########
06/22/25 13:33:58 EDT -0400 | ########## START ##########
06/22/25 13:33:58 EDT -0400 | Battery power mode
06/22/25 13:33:58 EDT -0400 | Shutdown scheduled for Sun 2025-06-22 14:03:58 EDT, use 'shutdown -c' to cancel.
06/22/25 13:33:58 EDT -0400 | ##########  END  ##########
06/22/25 17:33:50 EDT -0400 | ########## START ##########
06/22/25 17:33:50 EDT -0400 | Battery power mode
06/22/25 17:33:50 EDT -0400 | Shutdown scheduled for Sun 2025-06-22 18:03:50 EDT, use 'shutdown -c' to cancel.
06/22/25 17:33:50 EDT -0400 | ##########  END  ##########
06/22/25 21:33:50 EDT -0400 | ########## START ##########
06/22/25 21:33:50 EDT -0400 | Battery power mode
06/22/25 21:33:50 EDT -0400 | Shutdown scheduled for Sun 2025-06-22 22:03:50 EDT, use 'shutdown -c' to cancel.
06/22/25 21:33:50 EDT -0400 | ##########  END  ##########
06/23/25 01:33:50 EDT -0400 | ########## START ##########
06/23/25 01:33:50 EDT -0400 | Battery power mode
06/23/25 01:33:50 EDT -0400 | Shutdown scheduled for Mon 2025-06-23 02:03:50 EDT, use 'shutdown -c' to cancel.
06/23/25 01:33:50 EDT -0400 | ##########  END  ##########
06/23/25 05:33:50 EDT -0400 | ########## START ##########
06/23/25 05:33:50 EDT -0400 | Battery power mode
06/23/25 05:33:50 EDT -0400 | Shutdown scheduled for Mon 2025-06-23 06:03:50 EDT, use 'shutdown -c' to cancel.
06/23/25 05:33:50 EDT -0400 | ##########  END  ##########
06/23/25 09:33:50 EDT -0400 | ########## START ##########
06/23/25 09:33:50 EDT -0400 | Battery power mode
06/23/25 09:33:50 EDT -0400 | Shutdown scheduled for Mon 2025-06-23 10:03:50 EDT, use 'shutdown -c' to cancel.
06/23/25 09:33:50 EDT -0400 | ##########  END  ##########
06/23/25 13:33:50 EDT -0400 | ########## START ##########
06/23/25 13:33:50 EDT -0400 | Battery power mode
06/23/25 13:33:50 EDT -0400 | Shutdown scheduled for Mon 2025-06-23 14:03:50 EDT, use 'shutdown -c' to cancel.
06/23/25 13:33:50 EDT -0400 | ##########  END  ##########
06/23/25 17:33:50 EDT -0400 | ########## START ##########
06/23/25 17:33:50 EDT -0400 | Battery power mode
06/23/25 17:33:50 EDT -0400 | Shutdown scheduled for Mon 2025-06-23 18:03:50 EDT, use 'shutdown -c' to cancel.
06/23/25 17:33:50 EDT -0400 | ##########  END  ##########
06/23/25 21:33:49 EDT -0400 | ########## START ##########
06/23/25 21:33:49 EDT -0400 | Battery power mode
06/23/25 21:33:49 EDT -0400 | Shutdown scheduled for Mon 2025-06-23 22:03:49 EDT, use 'shutdown -c' to cancel.
06/23/25 21:33:49 EDT -0400 | ##########  END  ##########
06/24/25 01:33:50 EDT -0400 | ########## START ##########
06/24/25 01:33:50 EDT -0400 | Battery power mode
06/24/25 01:33:50 EDT -0400 | Shutdown scheduled for Tue 2025-06-24 02:03:50 EDT, use 'shutdown -c' to cancel.
06/24/25 01:33:50 EDT -0400 | ##########  END  ##########
06/24/25 05:33:50 EDT -0400 | ########## START ##########
06/24/25 05:33:50 EDT -0400 | Battery power mode
06/24/25 05:33:50 EDT -0400 | Shutdown scheduled for Tue 2025-06-24 06:03:50 EDT, use 'shutdown -c' to cancel.
06/24/25 05:33:50 EDT -0400 | ##########  END  ##########
06/24/25 09:33:50 EDT -0400 | ########## START ##########
06/24/25 09:33:50 EDT -0400 | Battery power mode
06/24/25 09:33:50 EDT -0400 | Shutdown scheduled for Tue 2025-06-24 10:03:50 EDT, use 'shutdown -c' to cancel.
06/24/25 09:33:50 EDT -0400 | ##########  END  ##########
06/24/25 13:33:50 EDT -0400 | ########## START ##########
06/24/25 13:33:50 EDT -0400 | Battery power mode
06/24/25 13:33:50 EDT -0400 | Shutdown scheduled for Tue 2025-06-24 14:03:50 EDT, use 'shutdown -c' to cancel.
06/24/25 13:33:50 EDT -0400 | ##########  END  ##########
06/24/25 17:33:51 EDT -0400 | ########## START ##########
06/24/25 17:33:51 EDT -0400 | Battery power mode
06/24/25 17:33:51 EDT -0400 | Shutdown scheduled for Tue 2025-06-24 18:03:51 EDT, use 'shutdown -c' to cancel.
06/24/25 17:33:51 EDT -0400 | ##########  END  ##########
06/24/25 21:33:51 EDT -0400 | ########## START ##########
06/24/25 21:33:51 EDT -0400 | Battery power mode
06/24/25 21:33:51 EDT -0400 | Shutdown scheduled for Tue 2025-06-24 22:03:51 EDT, use 'shutdown -c' to cancel.
06/24/25 21:33:51 EDT -0400 | ##########  END  ##########
06/25/25 01:33:50 EDT -0400 | ########## START ##########
06/25/25 01:33:50 EDT -0400 | Battery power mode
06/25/25 01:33:50 EDT -0400 | Shutdown scheduled for Wed 2025-06-25 02:03:50 EDT, use 'shutdown -c' to cancel.
06/25/25 01:33:50 EDT -0400 | ##########  END  ##########
06/25/25 05:33:50 EDT -0400 | ########## START ##########
06/25/25 05:33:50 EDT -0400 | Battery power mode
06/25/25 05:33:50 EDT -0400 | Shutdown scheduled for Wed 2025-06-25 06:03:50 EDT, use 'shutdown -c' to cancel.
06/25/25 05:33:50 EDT -0400 | ##########  END  ##########
06/25/25 09:33:50 EDT -0400 | ########## START ##########
06/25/25 09:33:50 EDT -0400 | Battery power mode
06/25/25 09:33:50 EDT -0400 | Shutdown scheduled for Wed 2025-06-25 10:03:50 EDT, use 'shutdown -c' to cancel.
06/25/25 09:33:50 EDT -0400 | ##########  END  ##########
06/25/25 13:33:51 EDT -0400 | ########## START ##########
06/25/25 13:33:51 EDT -0400 | Battery power mode
06/25/25 13:33:51 EDT -0400 | Shutdown scheduled for Wed 2025-06-25 14:03:51 EDT, use 'shutdown -c' to cancel.
06/25/25 13:33:51 EDT -0400 | ##########  END  ##########
06/25/25 17:33:51 EDT -0400 | ########## START ##########
06/25/25 17:33:51 EDT -0400 | Battery power mode
06/25/25 17:33:51 EDT -0400 | Shutdown scheduled for Wed 2025-06-25 18:03:51 EDT, use 'shutdown -c' to cancel.
06/25/25 17:33:51 EDT -0400 | ##########  END  ##########
06/25/25 21:33:51 EDT -0400 | ########## START ##########
06/25/25 21:33:51 EDT -0400 | Battery power mode
06/25/25 21:33:51 EDT -0400 | Shutdown scheduled for Wed 2025-06-25 22:03:51 EDT, use 'shutdown -c' to cancel.
06/25/25 21:33:51 EDT -0400 | ##########  END  ##########
06/26/25 01:33:51 EDT -0400 | ########## START ##########
06/26/25 01:33:51 EDT -0400 | Battery power mode
06/26/25 01:33:51 EDT -0400 | Shutdown scheduled for Thu 2025-06-26 02:03:51 EDT, use 'shutdown -c' to cancel.
06/26/25 01:33:51 EDT -0400 | ##########  END  ##########
06/26/25 05:33:51 EDT -0400 | ########## START ##########
06/26/25 05:33:51 EDT -0400 | Battery power mode
06/26/25 05:33:51 EDT -0400 | Shutdown scheduled for Thu 2025-06-26 06:03:51 EDT, use 'shutdown -c' to cancel.
06/26/25 05:33:51 EDT -0400 | ##########  END  ##########
06/26/25 09:33:51 EDT -0400 | ########## START ##########
06/26/25 09:33:51 EDT -0400 | Battery power mode
06/26/25 09:33:51 EDT -0400 | Shutdown scheduled for Thu 2025-06-26 10:03:51 EDT, use 'shutdown -c' to cancel.
06/26/25 09:33:51 EDT -0400 | ##########  END  ##########
06/26/25 13:33:51 EDT -0400 | ########## START ##########
06/26/25 13:33:51 EDT -0400 | Battery power mode
06/26/25 13:33:51 EDT -0400 | Shutdown scheduled for Thu 2025-06-26 14:03:51 EDT, use 'shutdown -c' to cancel.
06/26/25 13:33:51 EDT -0400 | ##########  END  ##########
06/26/25 17:33:51 EDT -0400 | ########## START ##########
06/26/25 17:33:51 EDT -0400 | Battery power mode
06/26/25 17:33:51 EDT -0400 | Shutdown scheduled for Thu 2025-06-26 18:03:51 EDT, use 'shutdown -c' to cancel.
06/26/25 17:33:51 EDT -0400 | ##########  END  ##########
06/26/25 21:33:51 EDT -0400 | ########## START ##########
06/26/25 21:33:51 EDT -0400 | Battery power mode
06/26/25 21:33:51 EDT -0400 | Shutdown scheduled for Thu 2025-06-26 22:03:51 EDT, use 'shutdown -c' to cancel.
06/26/25 21:33:51 EDT -0400 | ##########  END  ##########
06/27/25 01:33:51 EDT -0400 | ########## START ##########
06/27/25 01:33:51 EDT -0400 | Battery power mode
06/27/25 01:33:51 EDT -0400 | Shutdown scheduled for Fri 2025-06-27 02:03:51 EDT, use 'shutdown -c' to cancel.
06/27/25 01:33:51 EDT -0400 | ##########  END  ##########
06/27/25 05:33:51 EDT -0400 | ########## START ##########
06/27/25 05:33:51 EDT -0400 | Battery power mode
06/27/25 05:33:51 EDT -0400 | Shutdown scheduled for Fri 2025-06-27 06:03:51 EDT, use 'shutdown -c' to cancel.
06/27/25 05:33:51 EDT -0400 | ##########  END  ##########
06/27/25 09:33:51 EDT -0400 | ########## START ##########
06/27/25 09:33:51 EDT -0400 | Battery power mode
06/27/25 09:33:51 EDT -0400 | Shutdown scheduled for Fri 2025-06-27 10:03:51 EDT, use 'shutdown -c' to cancel.
06/27/25 09:33:51 EDT -0400 | ##########  END  ##########
06/27/25 13:33:51 EDT -0400 | ########## START ##########
06/27/25 13:33:51 EDT -0400 | Battery power mode
06/27/25 13:33:51 EDT -0400 | Shutdown scheduled for Fri 2025-06-27 14:03:51 EDT, use 'shutdown -c' to cancel.
06/27/25 13:33:51 EDT -0400 | ##########  END  ##########
06/27/25 17:33:51 EDT -0400 | ########## START ##########
06/27/25 17:33:51 EDT -0400 | Battery power mode
06/27/25 17:33:51 EDT -0400 | Shutdown scheduled for Fri 2025-06-27 18:03:51 EDT, use 'shutdown -c' to cancel.
06/27/25 17:33:51 EDT -0400 | ##########  END  ##########
06/27/25 21:33:57 EDT -0400 | ########## START ##########
06/27/25 21:33:57 EDT -0400 | Battery power mode
06/27/25 21:33:57 EDT -0400 | Shutdown scheduled for Fri 2025-06-27 22:03:57 EDT, use 'shutdown -c' to cancel.
06/27/25 21:33:57 EDT -0400 | ##########  END  ##########
06/28/25 01:33:51 EDT -0400 | ########## START ##########
06/28/25 01:33:51 EDT -0400 | Battery power mode
06/28/25 01:33:51 EDT -0400 | Shutdown scheduled for Sat 2025-06-28 02:03:51 EDT, use 'shutdown -c' to cancel.
06/28/25 01:33:51 EDT -0400 | ##########  END  ##########
06/28/25 05:33:51 EDT -0400 | ########## START ##########
06/28/25 05:33:51 EDT -0400 | Battery power mode
06/28/25 05:33:51 EDT -0400 | Shutdown scheduled for Sat 2025-06-28 06:03:51 EDT, use 'shutdown -c' to cancel.
06/28/25 05:33:51 EDT -0400 | ##########  END  ##########
06/28/25 09:33:51 EDT -0400 | ########## START ##########
06/28/25 09:33:51 EDT -0400 | Battery power mode
06/28/25 09:33:51 EDT -0400 | Shutdown scheduled for Sat 2025-06-28 10:03:51 EDT, use 'shutdown -c' to cancel.
06/28/25 09:33:51 EDT -0400 | ##########  END  ##########
06/28/25 13:33:51 EDT -0400 | ########## START ##########
06/28/25 13:33:51 EDT -0400 | Battery power mode
06/28/25 13:33:51 EDT -0400 | Shutdown scheduled for Sat 2025-06-28 14:03:51 EDT, use 'shutdown -c' to cancel.
06/28/25 13:33:51 EDT -0400 | ##########  END  ##########
06/28/25 17:33:50 EDT -0400 | ########## START ##########
06/28/25 17:33:50 EDT -0400 | Battery power mode
06/28/25 17:33:51 EDT -0400 | Shutdown scheduled for Sat 2025-06-28 18:03:51 EDT, use 'shutdown -c' to cancel.
06/28/25 17:33:51 EDT -0400 | ##########  END  ##########
06/28/25 21:33:51 EDT -0400 | ########## START ##########
06/28/25 21:33:51 EDT -0400 | Battery power mode
06/28/25 21:33:51 EDT -0400 | Shutdown scheduled for Sat 2025-06-28 22:03:51 EDT, use 'shutdown -c' to cancel.
06/28/25 21:33:51 EDT -0400 | ##########  END  ##########
06/29/25 01:33:51 EDT -0400 | ########## START ##########
06/29/25 01:33:51 EDT -0400 | Battery power mode
06/29/25 01:33:51 EDT -0400 | Shutdown scheduled for Sun 2025-06-29 02:03:51 EDT, use 'shutdown -c' to cancel.
06/29/25 01:33:51 EDT -0400 | ##########  END  ##########
06/29/25 05:33:51 EDT -0400 | ########## START ##########
06/29/25 05:33:51 EDT -0400 | Battery power mode
06/29/25 05:33:51 EDT -0400 | Shutdown scheduled for Sun 2025-06-29 06:03:51 EDT, use 'shutdown -c' to cancel.
06/29/25 05:33:51 EDT -0400 | ##########  END  ##########
06/29/25 09:33:51 EDT -0400 | ########## START ##########
06/29/25 09:33:51 EDT -0400 | Battery power mode
06/29/25 09:33:51 EDT -0400 | Shutdown scheduled for Sun 2025-06-29 10:03:51 EDT, use 'shutdown -c' to cancel.
06/29/25 09:33:51 EDT -0400 | ##########  END  ##########
06/29/25 13:33:52 EDT -0400 | ########## START ##########
06/29/25 13:33:52 EDT -0400 | Battery power mode
06/29/25 13:33:52 EDT -0400 | Shutdown scheduled for Sun 2025-06-29 14:03:52 EDT, use 'shutdown -c' to cancel.
06/29/25 13:33:52 EDT -0400 | ##########  END  ##########
06/29/25 17:33:51 EDT -0400 | ########## START ##########
06/29/25 17:33:51 EDT -0400 | Battery power mode
06/29/25 17:33:52 EDT -0400 | Shutdown scheduled for Sun 2025-06-29 18:03:52 EDT, use 'shutdown -c' to cancel.
06/29/25 17:33:52 EDT -0400 | ##########  END  ##########
06/29/25 21:33:51 EDT -0400 | ########## START ##########
06/29/25 21:33:51 EDT -0400 | Battery power mode
06/29/25 21:33:52 EDT -0400 | Shutdown scheduled for Sun 2025-06-29 22:03:52 EDT, use 'shutdown -c' to cancel.
06/29/25 21:33:52 EDT -0400 | ##########  END  ##########
06/30/25 01:33:51 EDT -0400 | ########## START ##########
06/30/25 01:33:51 EDT -0400 | Battery power mode
06/30/25 01:33:51 EDT -0400 | Shutdown scheduled for Mon 2025-06-30 02:03:51 EDT, use 'shutdown -c' to cancel.
06/30/25 01:33:51 EDT -0400 | ##########  END  ##########
06/30/25 05:33:52 EDT -0400 | ########## START ##########
06/30/25 05:33:52 EDT -0400 | Battery power mode
06/30/25 05:33:52 EDT -0400 | Shutdown scheduled for Mon 2025-06-30 06:03:52 EDT, use 'shutdown -c' to cancel.
06/30/25 05:33:52 EDT -0400 | ##########  END  ##########
06/30/25 09:33:53 EDT -0400 | ########## START ##########
06/30/25 09:33:53 EDT -0400 | Battery power mode
06/30/25 09:33:53 EDT -0400 | Shutdown scheduled for Mon 2025-06-30 10:03:53 EDT, use 'shutdown -c' to cancel.
06/30/25 09:33:53 EDT -0400 | ##########  END  ##########
06/30/25 13:33:52 EDT -0400 | ########## START ##########
06/30/25 13:33:52 EDT -0400 | Battery power mode
06/30/25 13:33:52 EDT -0400 | Shutdown scheduled for Mon 2025-06-30 14:03:52 EDT, use 'shutdown -c' to cancel.
06/30/25 13:33:52 EDT -0400 | ##########  END  ##########
06/30/25 17:33:52 EDT -0400 | ########## START ##########
06/30/25 17:33:52 EDT -0400 | Battery power mode
06/30/25 17:33:52 EDT -0400 | Shutdown scheduled for Mon 2025-06-30 18:03:52 EDT, use 'shutdown -c' to cancel.
06/30/25 17:33:52 EDT -0400 | ##########  END  ##########
06/30/25 21:33:52 EDT -0400 | ########## START ##########
06/30/25 21:33:52 EDT -0400 | Battery power mode
06/30/25 21:33:52 EDT -0400 | Shutdown scheduled for Mon 2025-06-30 22:03:52 EDT, use 'shutdown -c' to cancel.
06/30/25 21:33:52 EDT -0400 | ##########  END  ##########
07/01/25 01:33:52 EDT -0400 | ########## START ##########
07/01/25 01:33:52 EDT -0400 | Battery power mode
07/01/25 01:33:52 EDT -0400 | Shutdown scheduled for Tue 2025-07-01 02:03:52 EDT, use 'shutdown -c' to cancel.
07/01/25 01:33:52 EDT -0400 | ##########  END  ##########
07/01/25 05:33:52 EDT -0400 | ########## START ##########
07/01/25 05:33:52 EDT -0400 | Battery power mode
07/01/25 05:33:52 EDT -0400 | Shutdown scheduled for Tue 2025-07-01 06:03:52 EDT, use 'shutdown -c' to cancel.
07/01/25 05:33:52 EDT -0400 | ##########  END  ##########
07/01/25 09:33:52 EDT -0400 | ########## START ##########
07/01/25 09:33:52 EDT -0400 | Battery power mode
07/01/25 09:33:52 EDT -0400 | Shutdown scheduled for Tue 2025-07-01 10:03:52 EDT, use 'shutdown -c' to cancel.
07/01/25 09:33:52 EDT -0400 | ##########  END  ##########
07/01/25 13:33:52 EDT -0400 | ########## START ##########
07/01/25 13:33:52 EDT -0400 | Battery power mode
07/01/25 13:33:52 EDT -0400 | Shutdown scheduled for Tue 2025-07-01 14:03:52 EDT, use 'shutdown -c' to cancel.
07/01/25 13:33:52 EDT -0400 | ##########  END  ##########
07/01/25 17:33:52 EDT -0400 | ########## START ##########
07/01/25 17:33:52 EDT -0400 | Battery power mode
07/01/25 17:33:52 EDT -0400 | Shutdown scheduled for Tue 2025-07-01 18:03:52 EDT, use 'shutdown -c' to cancel.
07/01/25 17:33:52 EDT -0400 | ##########  END  ##########
07/01/25 21:33:52 EDT -0400 | ########## START ##########
07/01/25 21:33:52 EDT -0400 | Battery power mode
07/01/25 21:33:52 EDT -0400 | Shutdown scheduled for Tue 2025-07-01 22:03:52 EDT, use 'shutdown -c' to cancel.
07/01/25 21:33:52 EDT -0400 | ##########  END  ##########
07/02/25 01:33:52 EDT -0400 | ########## START ##########
07/02/25 01:33:52 EDT -0400 | Battery power mode
07/02/25 01:33:52 EDT -0400 | Shutdown scheduled for Wed 2025-07-02 02:03:52 EDT, use 'shutdown -c' to cancel.
07/02/25 01:33:52 EDT -0400 | ##########  END  ##########
07/02/25 05:33:52 EDT -0400 | ########## START ##########
07/02/25 05:33:52 EDT -0400 | Battery power mode
07/02/25 05:33:53 EDT -0400 | Shutdown scheduled for Wed 2025-07-02 06:03:53 EDT, use 'shutdown -c' to cancel.
07/02/25 05:33:53 EDT -0400 | ##########  END  ##########
07/02/25 09:33:52 EDT -0400 | ########## START ##########
07/02/25 09:33:52 EDT -0400 | Battery power mode
07/02/25 09:33:52 EDT -0400 | Shutdown scheduled for Wed 2025-07-02 10:03:52 EDT, use 'shutdown -c' to cancel.
07/02/25 09:33:52 EDT -0400 | ##########  END  ##########
07/02/25 13:33:52 EDT -0400 | ########## START ##########
07/02/25 13:33:52 EDT -0400 | Battery power mode
07/02/25 13:33:52 EDT -0400 | Shutdown scheduled for Wed 2025-07-02 14:03:52 EDT, use 'shutdown -c' to cancel.
07/02/25 13:33:52 EDT -0400 | ##########  END  ##########
07/02/25 17:33:52 EDT -0400 | ########## START ##########
07/02/25 17:33:52 EDT -0400 | Battery power mode
07/02/25 17:33:52 EDT -0400 | Shutdown scheduled for Wed 2025-07-02 18:03:52 EDT, use 'shutdown -c' to cancel.
07/02/25 17:33:52 EDT -0400 | ##########  END  ##########
07/02/25 21:33:52 EDT -0400 | ########## START ##########
07/02/25 21:33:52 EDT -0400 | Battery power mode
07/02/25 21:33:52 EDT -0400 | Shutdown scheduled for Wed 2025-07-02 22:03:52 EDT, use 'shutdown -c' to cancel.
07/02/25 21:33:52 EDT -0400 | ##########  END  ##########
07/03/25 01:33:52 EDT -0400 | ########## START ##########
07/03/25 01:33:52 EDT -0400 | Battery power mode
07/03/25 01:33:52 EDT -0400 | Shutdown scheduled for Thu 2025-07-03 02:03:52 EDT, use 'shutdown -c' to cancel.
07/03/25 01:33:52 EDT -0400 | ##########  END  ##########
07/03/25 05:33:52 EDT -0400 | ########## START ##########
07/03/25 05:33:52 EDT -0400 | Battery power mode
07/03/25 05:33:52 EDT -0400 | Shutdown scheduled for Thu 2025-07-03 06:03:52 EDT, use 'shutdown -c' to cancel.
07/03/25 05:33:52 EDT -0400 | ##########  END  ##########
07/03/25 09:33:52 EDT -0400 | ########## START ##########
07/03/25 09:33:52 EDT -0400 | Battery power mode
07/03/25 09:33:52 EDT -0400 | Shutdown scheduled for Thu 2025-07-03 10:03:52 EDT, use 'shutdown -c' to cancel.
07/03/25 09:33:52 EDT -0400 | ##########  END  ##########
07/03/25 13:33:52 EDT -0400 | ########## START ##########
07/03/25 13:33:52 EDT -0400 | Battery power mode
07/03/25 13:33:52 EDT -0400 | Shutdown scheduled for Thu 2025-07-03 14:03:52 EDT, use 'shutdown -c' to cancel.
07/03/25 13:33:52 EDT -0400 | ##########  END  ##########
07/03/25 17:33:52 EDT -0400 | ########## START ##########
07/03/25 17:33:52 EDT -0400 | Battery power mode
07/03/25 17:33:52 EDT -0400 | Shutdown scheduled for Thu 2025-07-03 18:03:52 EDT, use 'shutdown -c' to cancel.
07/03/25 17:33:52 EDT -0400 | ##########  END  ##########
07/03/25 21:33:52 EDT -0400 | ########## START ##########
07/03/25 21:33:52 EDT -0400 | Battery power mode
07/03/25 21:33:52 EDT -0400 | Shutdown scheduled for Thu 2025-07-03 22:03:52 EDT, use 'shutdown -c' to cancel.
07/03/25 21:33:52 EDT -0400 | ##########  END  ##########
07/04/25 01:33:52 EDT -0400 | ########## START ##########
07/04/25 01:33:52 EDT -0400 | Battery power mode
07/04/25 01:33:52 EDT -0400 | Shutdown scheduled for Fri 2025-07-04 02:03:52 EDT, use 'shutdown -c' to cancel.
07/04/25 01:33:52 EDT -0400 | ##########  END  ##########
07/04/25 05:33:53 EDT -0400 | ########## START ##########
07/04/25 05:33:53 EDT -0400 | Battery power mode
07/04/25 05:33:53 EDT -0400 | Shutdown scheduled for Fri 2025-07-04 06:03:53 EDT, use 'shutdown -c' to cancel.
07/04/25 05:33:53 EDT -0400 | ##########  END  ##########
07/04/25 09:33:52 EDT -0400 | ########## START ##########
07/04/25 09:33:53 EDT -0400 | Battery power mode
07/04/25 09:33:53 EDT -0400 | Shutdown scheduled for Fri 2025-07-04 10:03:53 EDT, use 'shutdown -c' to cancel.
07/04/25 09:33:53 EDT -0400 | ##########  END  ##########
07/04/25 13:33:52 EDT -0400 | ########## START ##########
07/04/25 13:33:52 EDT -0400 | Battery power mode
07/04/25 13:33:52 EDT -0400 | Shutdown scheduled for Fri 2025-07-04 14:03:52 EDT, use 'shutdown -c' to cancel.
07/04/25 13:33:52 EDT -0400 | ##########  END  ##########
07/04/25 17:33:52 EDT -0400 | ########## START ##########
07/04/25 17:33:52 EDT -0400 | Battery power mode
07/04/25 17:33:52 EDT -0400 | Shutdown scheduled for Fri 2025-07-04 18:03:52 EDT, use 'shutdown -c' to cancel.
07/04/25 17:33:52 EDT -0400 | ##########  END  ##########
07/04/25 21:33:52 EDT -0400 | ########## START ##########
07/04/25 21:33:52 EDT -0400 | Battery power mode
07/04/25 21:33:52 EDT -0400 | Shutdown scheduled for Fri 2025-07-04 22:03:52 EDT, use 'shutdown -c' to cancel.
07/04/25 21:33:52 EDT -0400 | ##########  END  ##########
07/05/25 01:33:52 EDT -0400 | ########## START ##########
07/05/25 01:33:52 EDT -0400 | Battery power mode
07/05/25 01:33:52 EDT -0400 | Shutdown scheduled for Sat 2025-07-05 02:03:52 EDT, use 'shutdown -c' to cancel.
07/05/25 01:33:52 EDT -0400 | ##########  END  ##########
07/05/25 05:33:52 EDT -0400 | ########## START ##########
07/05/25 05:33:52 EDT -0400 | Battery power mode
07/05/25 05:33:53 EDT -0400 | Shutdown scheduled for Sat 2025-07-05 06:03:53 EDT, use 'shutdown -c' to cancel.
07/05/25 05:33:53 EDT -0400 | ##########  END  ##########
07/05/25 09:33:52 EDT -0400 | ########## START ##########
07/05/25 09:33:52 EDT -0400 | Battery power mode
07/05/25 09:33:52 EDT -0400 | Shutdown scheduled for Sat 2025-07-05 10:03:52 EDT, use 'shutdown -c' to cancel.
07/05/25 09:33:52 EDT -0400 | ##########  END  ##########
07/05/25 13:33:52 EDT -0400 | ########## START ##########
07/05/25 13:33:52 EDT -0400 | Battery power mode
07/05/25 13:33:53 EDT -0400 | Shutdown scheduled for Sat 2025-07-05 14:03:53 EDT, use 'shutdown -c' to cancel.
07/05/25 13:33:53 EDT -0400 | ##########  END  ##########
07/05/25 17:33:53 EDT -0400 | ########## START ##########
07/05/25 17:33:53 EDT -0400 | Battery power mode
07/05/25 17:33:53 EDT -0400 | Shutdown scheduled for Sat 2025-07-05 18:03:53 EDT, use 'shutdown -c' to cancel.
07/05/25 17:33:53 EDT -0400 | ##########  END  ##########
07/05/25 21:33:53 EDT -0400 | ########## START ##########
07/05/25 21:33:53 EDT -0400 | Battery power mode
07/05/25 21:33:53 EDT -0400 | Shutdown scheduled for Sat 2025-07-05 22:03:53 EDT, use 'shutdown -c' to cancel.
07/05/25 21:33:53 EDT -0400 | ##########  END  ##########
07/06/25 01:33:53 EDT -0400 | ########## START ##########
07/06/25 01:33:53 EDT -0400 | Battery power mode
07/06/25 01:33:53 EDT -0400 | Shutdown scheduled for Sun 2025-07-06 02:03:53 EDT, use 'shutdown -c' to cancel.
07/06/25 01:33:53 EDT -0400 | ##########  END  ##########
07/06/25 05:33:53 EDT -0400 | ########## START ##########
07/06/25 05:33:53 EDT -0400 | Battery power mode
07/06/25 05:33:53 EDT -0400 | Shutdown scheduled for Sun 2025-07-06 06:03:53 EDT, use 'shutdown -c' to cancel.
07/06/25 05:33:53 EDT -0400 | ##########  END  ##########
07/06/25 09:33:53 EDT -0400 | ########## START ##########
07/06/25 09:33:53 EDT -0400 | Battery power mode
07/06/25 09:33:53 EDT -0400 | Shutdown scheduled for Sun 2025-07-06 10:03:53 EDT, use 'shutdown -c' to cancel.
07/06/25 09:33:53 EDT -0400 | ##########  END  ##########
07/06/25 13:33:53 EDT -0400 | ########## START ##########
07/06/25 13:33:53 EDT -0400 | Battery power mode
07/06/25 13:33:53 EDT -0400 | Shutdown scheduled for Sun 2025-07-06 14:03:53 EDT, use 'shutdown -c' to cancel.
07/06/25 13:33:53 EDT -0400 | ##########  END  ##########
07/06/25 17:33:53 EDT -0400 | ########## START ##########
07/06/25 17:33:53 EDT -0400 | Battery power mode
07/06/25 17:33:53 EDT -0400 | Shutdown scheduled for Sun 2025-07-06 18:03:53 EDT, use 'shutdown -c' to cancel.
07/06/25 17:33:53 EDT -0400 | ##########  END  ##########
07/06/25 21:33:53 EDT -0400 | ########## START ##########
07/06/25 21:33:53 EDT -0400 | Battery power mode
07/06/25 21:33:53 EDT -0400 | Shutdown scheduled for Sun 2025-07-06 22:03:53 EDT, use 'shutdown -c' to cancel.
07/06/25 21:33:53 EDT -0400 | ##########  END  ##########
07/07/25 01:33:53 EDT -0400 | ########## START ##########
07/07/25 01:33:53 EDT -0400 | Battery power mode
07/07/25 01:33:53 EDT -0400 | Shutdown scheduled for Mon 2025-07-07 02:03:53 EDT, use 'shutdown -c' to cancel.
07/07/25 01:33:53 EDT -0400 | ##########  END  ##########
07/07/25 05:33:53 EDT -0400 | ########## START ##########
07/07/25 05:33:53 EDT -0400 | Battery power mode
07/07/25 05:33:53 EDT -0400 | Shutdown scheduled for Mon 2025-07-07 06:03:53 EDT, use 'shutdown -c' to cancel.
07/07/25 05:33:53 EDT -0400 | ##########  END  ##########
07/07/25 09:33:53 EDT -0400 | ########## START ##########
07/07/25 09:33:53 EDT -0400 | Battery power mode
07/07/25 09:33:53 EDT -0400 | Shutdown scheduled for Mon 2025-07-07 10:03:53 EDT, use 'shutdown -c' to cancel.
07/07/25 09:33:53 EDT -0400 | ##########  END  ##########
07/07/25 13:33:53 EDT -0400 | ########## START ##########
07/07/25 13:33:53 EDT -0400 | Battery power mode
07/07/25 13:33:53 EDT -0400 | Shutdown scheduled for Mon 2025-07-07 14:03:53 EDT, use 'shutdown -c' to cancel.
07/07/25 13:33:53 EDT -0400 | ##########  END  ##########
07/07/25 17:33:53 EDT -0400 | ########## START ##########
07/07/25 17:33:53 EDT -0400 | Battery power mode
07/07/25 17:33:53 EDT -0400 | Shutdown scheduled for Mon 2025-07-07 18:03:53 EDT, use 'shutdown -c' to cancel.
07/07/25 17:33:53 EDT -0400 | ##########  END  ##########
07/07/25 21:33:53 EDT -0400 | ########## START ##########
07/07/25 21:33:53 EDT -0400 | Battery power mode
07/07/25 21:33:53 EDT -0400 | Shutdown scheduled for Mon 2025-07-07 22:03:53 EDT, use 'shutdown -c' to cancel.
07/07/25 21:33:53 EDT -0400 | ##########  END  ##########
07/08/25 01:33:53 EDT -0400 | ########## START ##########
07/08/25 01:33:53 EDT -0400 | Battery power mode
07/08/25 01:33:53 EDT -0400 | Shutdown scheduled for Tue 2025-07-08 02:03:53 EDT, use 'shutdown -c' to cancel.
07/08/25 01:33:53 EDT -0400 | ##########  END  ##########
07/08/25 05:33:53 EDT -0400 | ########## START ##########
07/08/25 05:33:53 EDT -0400 | Battery power mode
07/08/25 05:33:53 EDT -0400 | Shutdown scheduled for Tue 2025-07-08 06:03:53 EDT, use 'shutdown -c' to cancel.
07/08/25 05:33:53 EDT -0400 | ##########  END  ##########
07/08/25 09:33:53 EDT -0400 | ########## START ##########
07/08/25 09:33:53 EDT -0400 | Battery power mode
07/08/25 09:33:53 EDT -0400 | Shutdown scheduled for Tue 2025-07-08 10:03:53 EDT, use 'shutdown -c' to cancel.
07/08/25 09:33:53 EDT -0400 | ##########  END  ##########
07/08/25 13:33:53 EDT -0400 | ########## START ##########
07/08/25 13:33:53 EDT -0400 | Battery power mode
07/08/25 13:33:53 EDT -0400 | Shutdown scheduled for Tue 2025-07-08 14:03:53 EDT, use 'shutdown -c' to cancel.
07/08/25 13:33:53 EDT -0400 | ##########  END  ##########
07/08/25 17:33:53 EDT -0400 | ########## START ##########
07/08/25 17:33:53 EDT -0400 | Battery power mode
07/08/25 17:33:53 EDT -0400 | Shutdown scheduled for Tue 2025-07-08 18:03:53 EDT, use 'shutdown -c' to cancel.
07/08/25 17:33:53 EDT -0400 | ##########  END  ##########
07/08/25 21:33:53 EDT -0400 | ########## START ##########
07/08/25 21:33:53 EDT -0400 | Battery power mode
07/08/25 21:33:53 EDT -0400 | Shutdown scheduled for Tue 2025-07-08 22:03:53 EDT, use 'shutdown -c' to cancel.
07/08/25 21:33:53 EDT -0400 | ##########  END  ##########
07/09/25 01:33:53 EDT -0400 | ########## START ##########
07/09/25 01:33:53 EDT -0400 | Battery power mode
07/09/25 01:33:53 EDT -0400 | Shutdown scheduled for Wed 2025-07-09 02:03:53 EDT, use 'shutdown -c' to cancel.
07/09/25 01:33:54 EDT -0400 | ##########  END  ##########
07/09/25 05:33:53 EDT -0400 | ########## START ##########
07/09/25 05:33:53 EDT -0400 | Battery power mode
07/09/25 05:33:53 EDT -0400 | Shutdown scheduled for Wed 2025-07-09 06:03:53 EDT, use 'shutdown -c' to cancel.
07/09/25 05:33:53 EDT -0400 | ##########  END  ##########
07/09/25 09:33:53 EDT -0400 | ########## START ##########
07/09/25 09:33:53 EDT -0400 | Battery power mode
07/09/25 09:33:53 EDT -0400 | Shutdown scheduled for Wed 2025-07-09 10:03:53 EDT, use 'shutdown -c' to cancel.
07/09/25 09:33:53 EDT -0400 | ##########  END  ##########
07/09/25 13:33:53 EDT -0400 | ########## START ##########
07/09/25 13:33:53 EDT -0400 | Battery power mode
07/09/25 13:33:53 EDT -0400 | Shutdown scheduled for Wed 2025-07-09 14:03:53 EDT, use 'shutdown -c' to cancel.
07/09/25 13:33:53 EDT -0400 | ##########  END  ##########
07/09/25 17:33:53 EDT -0400 | ########## START ##########
07/09/25 17:33:53 EDT -0400 | Battery power mode
07/09/25 17:33:53 EDT -0400 | Shutdown scheduled for Wed 2025-07-09 18:03:53 EDT, use 'shutdown -c' to cancel.
07/09/25 17:33:53 EDT -0400 | ##########  END  ##########
07/09/25 21:33:53 EDT -0400 | ########## START ##########
07/09/25 21:33:53 EDT -0400 | Battery power mode
07/09/25 21:33:53 EDT -0400 | Shutdown scheduled for Wed 2025-07-09 22:03:53 EDT, use 'shutdown -c' to cancel.
07/09/25 21:33:53 EDT -0400 | ##########  END  ##########
07/10/25 01:33:53 EDT -0400 | ########## START ##########
07/10/25 01:33:53 EDT -0400 | Battery power mode
07/10/25 01:33:53 EDT -0400 | Shutdown scheduled for Thu 2025-07-10 02:03:53 EDT, use 'shutdown -c' to cancel.
07/10/25 01:33:53 EDT -0400 | ##########  END  ##########
07/10/25 05:33:53 EDT -0400 | ########## START ##########
07/10/25 05:33:53 EDT -0400 | Battery power mode
07/10/25 05:33:53 EDT -0400 | Shutdown scheduled for Thu 2025-07-10 06:03:53 EDT, use 'shutdown -c' to cancel.
07/10/25 05:33:53 EDT -0400 | ##########  END  ##########
07/10/25 09:33:54 EDT -0400 | ########## START ##########
07/10/25 09:33:54 EDT -0400 | Battery power mode
07/10/25 09:33:54 EDT -0400 | Shutdown scheduled for Thu 2025-07-10 10:03:54 EDT, use 'shutdown -c' to cancel.
07/10/25 09:33:54 EDT -0400 | ##########  END  ##########
07/10/25 13:33:54 EDT -0400 | ########## START ##########
07/10/25 13:33:54 EDT -0400 | Battery power mode
07/10/25 13:33:54 EDT -0400 | Shutdown scheduled for Thu 2025-07-10 14:03:54 EDT, use 'shutdown -c' to cancel.
07/10/25 13:33:54 EDT -0400 | ##########  END  ##########
07/10/25 17:33:54 EDT -0400 | ########## START ##########
07/10/25 17:33:54 EDT -0400 | Battery power mode
07/10/25 17:33:54 EDT -0400 | Shutdown scheduled for Thu 2025-07-10 18:03:54 EDT, use 'shutdown -c' to cancel.
07/10/25 17:33:54 EDT -0400 | ##########  END  ##########
07/10/25 21:33:54 EDT -0400 | ########## START ##########
07/10/25 21:33:54 EDT -0400 | Battery power mode
07/10/25 21:33:54 EDT -0400 | Shutdown scheduled for Thu 2025-07-10 22:03:54 EDT, use 'shutdown -c' to cancel.
07/10/25 21:33:54 EDT -0400 | ##########  END  ##########
07/11/25 01:33:54 EDT -0400 | ########## START ##########
07/11/25 01:33:54 EDT -0400 | Battery power mode
07/11/25 01:33:54 EDT -0400 | Shutdown scheduled for Fri 2025-07-11 02:03:54 EDT, use 'shutdown -c' to cancel.
07/11/25 01:33:54 EDT -0400 | ##########  END  ##########
07/11/25 05:33:53 EDT -0400 | ########## START ##########
07/11/25 05:33:53 EDT -0400 | Battery power mode
07/11/25 05:33:54 EDT -0400 | Shutdown scheduled for Fri 2025-07-11 06:03:54 EDT, use 'shutdown -c' to cancel.
07/11/25 05:33:54 EDT -0400 | ##########  END  ##########
07/11/25 09:33:54 EDT -0400 | ########## START ##########
07/11/25 09:33:54 EDT -0400 | Battery power mode
07/11/25 09:33:54 EDT -0400 | Shutdown scheduled for Fri 2025-07-11 10:03:54 EDT, use 'shutdown -c' to cancel.
07/11/25 09:33:54 EDT -0400 | ##########  END  ##########
07/11/25 13:33:54 EDT -0400 | ########## START ##########
07/11/25 13:33:54 EDT -0400 | Battery power mode
07/11/25 13:33:54 EDT -0400 | Shutdown scheduled for Fri 2025-07-11 14:03:54 EDT, use 'shutdown -c' to cancel.
07/11/25 13:33:54 EDT -0400 | ##########  END  ##########
07/11/25 17:33:54 EDT -0400 | ########## START ##########
07/11/25 17:33:54 EDT -0400 | Battery power mode
07/11/25 17:33:54 EDT -0400 | Shutdown scheduled for Fri 2025-07-11 18:03:54 EDT, use 'shutdown -c' to cancel.
07/11/25 17:33:54 EDT -0400 | ##########  END  ##########
07/11/25 21:33:54 EDT -0400 | ########## START ##########
07/11/25 21:33:54 EDT -0400 | Battery power mode
07/11/25 21:33:54 EDT -0400 | Shutdown scheduled for Fri 2025-07-11 22:03:54 EDT, use 'shutdown -c' to cancel.
07/11/25 21:33:54 EDT -0400 | ##########  END  ##########
07/12/25 01:33:54 EDT -0400 | ########## START ##########
07/12/25 01:33:54 EDT -0400 | Battery power mode
07/12/25 01:33:54 EDT -0400 | Shutdown scheduled for Sat 2025-07-12 02:03:54 EDT, use 'shutdown -c' to cancel.
07/12/25 01:33:54 EDT -0400 | ##########  END  ##########
07/12/25 05:33:54 EDT -0400 | ########## START ##########
07/12/25 05:33:54 EDT -0400 | Battery power mode
07/12/25 05:33:54 EDT -0400 | Shutdown scheduled for Sat 2025-07-12 06:03:54 EDT, use 'shutdown -c' to cancel.
07/12/25 05:33:54 EDT -0400 | ##########  END  ##########
07/12/25 09:33:54 EDT -0400 | ########## START ##########
07/12/25 09:33:54 EDT -0400 | Battery power mode
07/12/25 09:33:54 EDT -0400 | Shutdown scheduled for Sat 2025-07-12 10:03:54 EDT, use 'shutdown -c' to cancel.
07/12/25 09:33:54 EDT -0400 | ##########  END  ##########
07/12/25 13:33:54 EDT -0400 | ########## START ##########
07/12/25 13:33:54 EDT -0400 | Battery power mode
07/12/25 13:33:54 EDT -0400 | Shutdown scheduled for Sat 2025-07-12 14:03:54 EDT, use 'shutdown -c' to cancel.
07/12/25 13:33:54 EDT -0400 | ##########  END  ##########
07/12/25 17:33:54 EDT -0400 | ########## START ##########
07/12/25 17:33:54 EDT -0400 | Battery power mode
07/12/25 17:33:54 EDT -0400 | Shutdown scheduled for Sat 2025-07-12 18:03:54 EDT, use 'shutdown -c' to cancel.
07/12/25 17:33:54 EDT -0400 | ##########  END  ##########
07/12/25 21:33:54 EDT -0400 | ########## START ##########
07/12/25 21:33:54 EDT -0400 | Battery power mode
07/12/25 21:33:54 EDT -0400 | Shutdown scheduled for Sat 2025-07-12 22:03:54 EDT, use 'shutdown -c' to cancel.
07/12/25 21:33:54 EDT -0400 | ##########  END  ##########
07/13/25 01:33:54 EDT -0400 | ########## START ##########
07/13/25 01:33:54 EDT -0400 | Battery power mode
07/13/25 01:33:54 EDT -0400 | Shutdown scheduled for Sun 2025-07-13 02:03:54 EDT, use 'shutdown -c' to cancel.
07/13/25 01:33:54 EDT -0400 | ##########  END  ##########
07/13/25 05:33:54 EDT -0400 | ########## START ##########
07/13/25 05:33:54 EDT -0400 | Battery power mode
07/13/25 05:33:54 EDT -0400 | Shutdown scheduled for Sun 2025-07-13 06:03:54 EDT, use 'shutdown -c' to cancel.
07/13/25 05:33:54 EDT -0400 | ##########  END  ##########
07/13/25 09:33:54 EDT -0400 | ########## START ##########
07/13/25 09:33:54 EDT -0400 | Battery power mode
07/13/25 09:33:54 EDT -0400 | Shutdown scheduled for Sun 2025-07-13 10:03:54 EDT, use 'shutdown -c' to cancel.
07/13/25 09:33:54 EDT -0400 | ##########  END  ##########
07/13/25 13:33:54 EDT -0400 | ########## START ##########
07/13/25 13:33:54 EDT -0400 | Battery power mode
07/13/25 13:33:54 EDT -0400 | Shutdown scheduled for Sun 2025-07-13 14:03:54 EDT, use 'shutdown -c' to cancel.
07/13/25 13:33:54 EDT -0400 | ##########  END  ##########
07/13/25 17:33:55 EDT -0400 | ########## START ##########
07/13/25 17:33:55 EDT -0400 | Battery power mode
07/13/25 17:33:55 EDT -0400 | Shutdown scheduled for Sun 2025-07-13 18:03:55 EDT, use 'shutdown -c' to cancel.
07/13/25 17:33:55 EDT -0400 | ##########  END  ##########
07/13/25 21:33:54 EDT -0400 | ########## START ##########
07/13/25 21:33:54 EDT -0400 | Battery power mode
07/13/25 21:33:54 EDT -0400 | Shutdown scheduled for Sun 2025-07-13 22:03:54 EDT, use 'shutdown -c' to cancel.
07/13/25 21:33:54 EDT -0400 | ##########  END  ##########
07/14/25 01:33:54 EDT -0400 | ########## START ##########
07/14/25 01:33:54 EDT -0400 | Battery power mode
07/14/25 01:33:54 EDT -0400 | Shutdown scheduled for Mon 2025-07-14 02:03:54 EDT, use 'shutdown -c' to cancel.
07/14/25 01:33:54 EDT -0400 | ##########  END  ##########
07/14/25 05:33:54 EDT -0400 | ########## START ##########
07/14/25 05:33:54 EDT -0400 | Battery power mode
07/14/25 05:33:55 EDT -0400 | Shutdown scheduled for Mon 2025-07-14 06:03:54 EDT, use 'shutdown -c' to cancel.
07/14/25 05:33:55 EDT -0400 | ##########  END  ##########
07/14/25 09:33:54 EDT -0400 | ########## START ##########
07/14/25 09:33:54 EDT -0400 | Battery power mode
07/14/25 09:33:54 EDT -0400 | Shutdown scheduled for Mon 2025-07-14 10:03:54 EDT, use 'shutdown -c' to cancel.
07/14/25 09:33:54 EDT -0400 | ##########  END  ##########
07/14/25 13:33:54 EDT -0400 | ########## START ##########
07/14/25 13:33:54 EDT -0400 | Battery power mode
07/14/25 13:33:54 EDT -0400 | Shutdown scheduled for Mon 2025-07-14 14:03:54 EDT, use 'shutdown -c' to cancel.
07/14/25 13:33:54 EDT -0400 | ##########  END  ##########
07/14/25 17:33:54 EDT -0400 | ########## START ##########
07/14/25 17:33:54 EDT -0400 | Battery power mode
07/14/25 17:33:54 EDT -0400 | Shutdown scheduled for Mon 2025-07-14 18:03:54 EDT, use 'shutdown -c' to cancel.
07/14/25 17:33:54 EDT -0400 | ##########  END  ##########
07/14/25 21:33:54 EDT -0400 | ########## START ##########
07/14/25 21:33:55 EDT -0400 | Battery power mode
07/14/25 21:33:55 EDT -0400 | Shutdown scheduled for Mon 2025-07-14 22:03:55 EDT, use 'shutdown -c' to cancel.
07/14/25 21:33:55 EDT -0400 | ##########  END  ##########
07/15/25 01:33:54 EDT -0400 | ########## START ##########
07/15/25 01:33:54 EDT -0400 | Battery power mode
07/15/25 01:33:54 EDT -0400 | Shutdown scheduled for Tue 2025-07-15 02:03:54 EDT, use 'shutdown -c' to cancel.
07/15/25 01:33:54 EDT -0400 | ##########  END  ##########
07/15/25 05:33:54 EDT -0400 | ########## START ##########
07/15/25 05:33:54 EDT -0400 | Battery power mode
07/15/25 05:33:54 EDT -0400 | Shutdown scheduled for Tue 2025-07-15 06:03:54 EDT, use 'shutdown -c' to cancel.
07/15/25 05:33:54 EDT -0400 | ##########  END  ##########
07/15/25 09:33:54 EDT -0400 | ########## START ##########
07/15/25 09:33:54 EDT -0400 | Battery power mode
07/15/25 09:33:55 EDT -0400 | Shutdown scheduled for Tue 2025-07-15 10:03:55 EDT, use 'shutdown -c' to cancel.
07/15/25 09:33:55 EDT -0400 | ##########  END  ##########
07/15/25 13:33:55 EDT -0400 | ########## START ##########
07/15/25 13:33:55 EDT -0400 | Battery power mode
07/15/25 13:33:55 EDT -0400 | Shutdown scheduled for Tue 2025-07-15 14:03:55 EDT, use 'shutdown -c' to cancel.
07/15/25 13:33:55 EDT -0400 | ##########  END  ##########
07/15/25 17:33:55 EDT -0400 | ########## START ##########
07/15/25 17:33:55 EDT -0400 | Battery power mode
07/15/25 17:33:55 EDT -0400 | Shutdown scheduled for Tue 2025-07-15 18:03:55 EDT, use 'shutdown -c' to cancel.
07/15/25 17:33:55 EDT -0400 | ##########  END  ##########
07/15/25 21:33:55 EDT -0400 | ########## START ##########
07/15/25 21:33:55 EDT -0400 | Battery power mode
07/15/25 21:33:55 EDT -0400 | Shutdown scheduled for Tue 2025-07-15 22:03:55 EDT, use 'shutdown -c' to cancel.
07/15/25 21:33:55 EDT -0400 | ##########  END  ##########
07/16/25 01:33:55 EDT -0400 | ########## START ##########
07/16/25 01:33:55 EDT -0400 | Battery power mode
07/16/25 01:33:55 EDT -0400 | Shutdown scheduled for Wed 2025-07-16 02:03:55 EDT, use 'shutdown -c' to cancel.
07/16/25 01:33:55 EDT -0400 | ##########  END  ##########
07/16/25 05:33:55 EDT -0400 | ########## START ##########
07/16/25 05:33:55 EDT -0400 | Battery power mode
07/16/25 05:33:55 EDT -0400 | Shutdown scheduled for Wed 2025-07-16 06:03:55 EDT, use 'shutdown -c' to cancel.
07/16/25 05:33:55 EDT -0400 | ##########  END  ##########
07/16/25 09:33:55 EDT -0400 | ########## START ##########
07/16/25 09:33:55 EDT -0400 | Battery power mode
07/16/25 09:33:55 EDT -0400 | Shutdown scheduled for Wed 2025-07-16 10:03:55 EDT, use 'shutdown -c' to cancel.
07/16/25 09:33:55 EDT -0400 | ##########  END  ##########
07/16/25 13:33:55 EDT -0400 | ########## START ##########
07/16/25 13:33:55 EDT -0400 | Battery power mode
07/16/25 13:33:55 EDT -0400 | Shutdown scheduled for Wed 2025-07-16 14:03:55 EDT, use 'shutdown -c' to cancel.
07/16/25 13:33:55 EDT -0400 | ##########  END  ##########
07/16/25 17:33:55 EDT -0400 | ########## START ##########
07/16/25 17:33:55 EDT -0400 | Battery power mode
07/16/25 17:33:55 EDT -0400 | Shutdown scheduled for Wed 2025-07-16 18:03:55 EDT, use 'shutdown -c' to cancel.
07/16/25 17:33:55 EDT -0400 | ##########  END  ##########
07/16/25 21:33:55 EDT -0400 | ########## START ##########
07/16/25 21:33:55 EDT -0400 | Battery power mode
07/16/25 21:33:55 EDT -0400 | Shutdown scheduled for Wed 2025-07-16 22:03:55 EDT, use 'shutdown -c' to cancel.
07/16/25 21:33:55 EDT -0400 | ##########  END  ##########
07/17/25 01:33:55 EDT -0400 | ########## START ##########
07/17/25 01:33:55 EDT -0400 | Battery power mode
07/17/25 01:33:55 EDT -0400 | Shutdown scheduled for Thu 2025-07-17 02:03:55 EDT, use 'shutdown -c' to cancel.
07/17/25 01:33:55 EDT -0400 | ##########  END  ##########
07/17/25 05:33:55 EDT -0400 | ########## START ##########
07/17/25 05:33:55 EDT -0400 | Battery power mode
07/17/25 05:33:55 EDT -0400 | Shutdown scheduled for Thu 2025-07-17 06:03:55 EDT, use 'shutdown -c' to cancel.
07/17/25 05:33:55 EDT -0400 | ##########  END  ##########
07/17/25 09:33:55 EDT -0400 | ########## START ##########
07/17/25 09:33:55 EDT -0400 | Battery power mode
07/17/25 09:33:55 EDT -0400 | Shutdown scheduled for Thu 2025-07-17 10:03:55 EDT, use 'shutdown -c' to cancel.
07/17/25 09:33:55 EDT -0400 | ##########  END  ##########
07/17/25 13:33:55 EDT -0400 | ########## START ##########
07/17/25 13:33:55 EDT -0400 | Battery power mode
07/17/25 13:33:55 EDT -0400 | Shutdown scheduled for Thu 2025-07-17 14:03:55 EDT, use 'shutdown -c' to cancel.
07/17/25 13:33:55 EDT -0400 | ##########  END  ##########
07/17/25 17:33:55 EDT -0400 | ########## START ##########
07/17/25 17:33:55 EDT -0400 | Battery power mode
07/17/25 17:33:55 EDT -0400 | Shutdown scheduled for Thu 2025-07-17 18:03:55 EDT, use 'shutdown -c' to cancel.
07/17/25 17:33:55 EDT -0400 | ##########  END  ##########
07/17/25 21:33:55 EDT -0400 | ########## START ##########
07/17/25 21:33:55 EDT -0400 | Battery power mode
07/17/25 21:33:55 EDT -0400 | Shutdown scheduled for Thu 2025-07-17 22:03:55 EDT, use 'shutdown -c' to cancel.
07/17/25 21:33:55 EDT -0400 | ##########  END  ##########
07/18/25 01:33:55 EDT -0400 | ########## START ##########
07/18/25 01:33:55 EDT -0400 | Battery power mode
07/18/25 01:33:55 EDT -0400 | Shutdown scheduled for Fri 2025-07-18 02:03:55 EDT, use 'shutdown -c' to cancel.
07/18/25 01:33:55 EDT -0400 | ##########  END  ##########
07/18/25 05:33:55 EDT -0400 | ########## START ##########
07/18/25 05:33:55 EDT -0400 | Battery power mode
07/18/25 05:33:55 EDT -0400 | Shutdown scheduled for Fri 2025-07-18 06:03:55 EDT, use 'shutdown -c' to cancel.
07/18/25 05:33:55 EDT -0400 | ##########  END  ##########
07/18/25 09:33:55 EDT -0400 | ########## START ##########
07/18/25 09:33:55 EDT -0400 | Battery power mode
07/18/25 09:33:56 EDT -0400 | Shutdown scheduled for Fri 2025-07-18 10:03:56 EDT, use 'shutdown -c' to cancel.
07/18/25 09:33:56 EDT -0400 | ##########  END  ##########
07/18/25 13:33:55 EDT -0400 | ########## START ##########
07/18/25 13:33:55 EDT -0400 | Battery power mode
07/18/25 13:33:55 EDT -0400 | Shutdown scheduled for Fri 2025-07-18 14:03:55 EDT, use 'shutdown -c' to cancel.
07/18/25 13:33:55 EDT -0400 | ##########  END  ##########
07/18/25 17:33:55 EDT -0400 | ########## START ##########
07/18/25 17:33:55 EDT -0400 | Battery power mode
07/18/25 17:33:55 EDT -0400 | Shutdown scheduled for Fri 2025-07-18 18:03:55 EDT, use 'shutdown -c' to cancel.
07/18/25 17:33:55 EDT -0400 | ##########  END  ##########
07/18/25 21:33:55 EDT -0400 | ########## START ##########
07/18/25 21:33:55 EDT -0400 | Battery power mode
07/18/25 21:33:55 EDT -0400 | Shutdown scheduled for Fri 2025-07-18 22:03:55 EDT, use 'shutdown -c' to cancel.
07/18/25 21:33:55 EDT -0400 | ##########  END  ##########
07/19/25 01:33:55 EDT -0400 | ########## START ##########
07/19/25 01:33:55 EDT -0400 | Battery power mode
07/19/25 01:33:55 EDT -0400 | Shutdown scheduled for Sat 2025-07-19 02:03:55 EDT, use 'shutdown -c' to cancel.
07/19/25 01:33:55 EDT -0400 | ##########  END  ##########
07/19/25 05:33:55 EDT -0400 | ########## START ##########
07/19/25 05:33:55 EDT -0400 | Battery power mode
07/19/25 05:33:56 EDT -0400 | Shutdown scheduled for Sat 2025-07-19 06:03:56 EDT, use 'shutdown -c' to cancel.
07/19/25 05:33:56 EDT -0400 | ##########  END  ##########
07/19/25 09:33:55 EDT -0400 | ########## START ##########
07/19/25 09:33:55 EDT -0400 | Battery power mode
07/19/25 09:33:55 EDT -0400 | Shutdown scheduled for Sat 2025-07-19 10:03:55 EDT, use 'shutdown -c' to cancel.
07/19/25 09:33:55 EDT -0400 | ##########  END  ##########
07/19/25 13:33:55 EDT -0400 | ########## START ##########
07/19/25 13:33:55 EDT -0400 | Battery power mode
07/19/25 13:33:55 EDT -0400 | Shutdown scheduled for Sat 2025-07-19 14:03:55 EDT, use 'shutdown -c' to cancel.
07/19/25 13:33:55 EDT -0400 | ##########  END  ##########
07/19/25 17:33:55 EDT -0400 | ########## START ##########
07/19/25 17:33:55 EDT -0400 | Battery power mode
07/19/25 17:33:56 EDT -0400 | Shutdown scheduled for Sat 2025-07-19 18:03:56 EDT, use 'shutdown -c' to cancel.
07/19/25 17:33:56 EDT -0400 | ##########  END  ##########
07/19/25 21:33:55 EDT -0400 | ########## START ##########
07/19/25 21:33:55 EDT -0400 | Battery power mode
07/19/25 21:33:55 EDT -0400 | Shutdown scheduled for Sat 2025-07-19 22:03:55 EDT, use 'shutdown -c' to cancel.
07/19/25 21:33:55 EDT -0400 | ##########  END  ##########
07/20/25 01:33:55 EDT -0400 | ########## START ##########
07/20/25 01:33:55 EDT -0400 | Battery power mode
07/20/25 01:33:55 EDT -0400 | Shutdown scheduled for Sun 2025-07-20 02:03:55 EDT, use 'shutdown -c' to cancel.
07/20/25 01:33:55 EDT -0400 | ##########  END  ##########
07/20/25 05:33:55 EDT -0400 | ########## START ##########
07/20/25 05:33:55 EDT -0400 | Battery power mode
07/20/25 05:33:55 EDT -0400 | Shutdown scheduled for Sun 2025-07-20 06:03:55 EDT, use 'shutdown -c' to cancel.
07/20/25 05:33:55 EDT -0400 | ##########  END  ##########
07/20/25 09:33:56 EDT -0400 | ########## START ##########
07/20/25 09:33:56 EDT -0400 | Battery power mode
07/20/25 09:33:56 EDT -0400 | Shutdown scheduled for Sun 2025-07-20 10:03:56 EDT, use 'shutdown -c' to cancel.
07/20/25 09:33:56 EDT -0400 | ##########  END  ##########
07/20/25 13:33:55 EDT -0400 | ########## START ##########
07/20/25 13:33:55 EDT -0400 | Battery power mode
07/20/25 13:33:55 EDT -0400 | Shutdown scheduled for Sun 2025-07-20 14:03:55 EDT, use 'shutdown -c' to cancel.
07/20/25 13:33:55 EDT -0400 | ##########  END  ##########
07/20/25 17:33:55 EDT -0400 | ########## START ##########
07/20/25 17:33:55 EDT -0400 | Battery power mode
07/20/25 17:33:55 EDT -0400 | Shutdown scheduled for Sun 2025-07-20 18:03:55 EDT, use 'shutdown -c' to cancel.
07/20/25 17:33:55 EDT -0400 | ##########  END  ##########
07/20/25 21:33:56 EDT -0400 | ########## START ##########
07/20/25 21:33:56 EDT -0400 | Battery power mode
07/20/25 21:33:56 EDT -0400 | Shutdown scheduled for Sun 2025-07-20 22:03:56 EDT, use 'shutdown -c' to cancel.
07/20/25 21:33:56 EDT -0400 | ##########  END  ##########
07/21/25 01:33:55 EDT -0400 | ########## START ##########
07/21/25 01:33:55 EDT -0400 | Battery power mode
07/21/25 01:33:55 EDT -0400 | Shutdown scheduled for Mon 2025-07-21 02:03:55 EDT, use 'shutdown -c' to cancel.
07/21/25 01:33:55 EDT -0400 | ##########  END  ##########
07/21/25 05:33:56 EDT -0400 | ########## START ##########
07/21/25 05:33:56 EDT -0400 | Battery power mode
07/21/25 05:33:56 EDT -0400 | Shutdown scheduled for Mon 2025-07-21 06:03:56 EDT, use 'shutdown -c' to cancel.
07/21/25 05:33:56 EDT -0400 | ##########  END  ##########
07/21/25 09:33:55 EDT -0400 | ########## START ##########
07/21/25 09:33:55 EDT -0400 | Battery power mode
07/21/25 09:33:56 EDT -0400 | Shutdown scheduled for Mon 2025-07-21 10:03:56 EDT, use 'shutdown -c' to cancel.
07/21/25 09:33:56 EDT -0400 | ##########  END  ##########
07/21/25 13:33:56 EDT -0400 | ########## START ##########
07/21/25 13:33:56 EDT -0400 | Battery power mode
07/21/25 13:33:56 EDT -0400 | Shutdown scheduled for Mon 2025-07-21 14:03:56 EDT, use 'shutdown -c' to cancel.
07/21/25 13:33:56 EDT -0400 | ##########  END  ##########
07/21/25 17:33:56 EDT -0400 | ########## START ##########
07/21/25 17:33:56 EDT -0400 | Battery power mode
07/21/25 17:33:56 EDT -0400 | Shutdown scheduled for Mon 2025-07-21 18:03:56 EDT, use 'shutdown -c' to cancel.
07/21/25 17:33:56 EDT -0400 | ##########  END  ##########
07/21/25 21:33:56 EDT -0400 | ########## START ##########
07/21/25 21:33:56 EDT -0400 | Battery power mode
07/21/25 21:33:56 EDT -0400 | Shutdown scheduled for Mon 2025-07-21 22:03:56 EDT, use 'shutdown -c' to cancel.
07/21/25 21:33:56 EDT -0400 | ##########  END  ##########
07/22/25 01:33:56 EDT -0400 | ########## START ##########
